,Poster_Link,Series_Title,Released_Year,Certificate,Runtime,Genre,IMDB_Rating,Overview,Meta_score,Director,Star1,Star2,Star3,Star4,No_of_Votes,Gross,Autor_libro,Nota_promedio_libro,Votos_libro
250,"https://m.media-amazon.com/images/M/MV5BMDIzODcyY2EtMmY2MC00ZWVlLTgwMzAtMjQwOWUyNmJjNTYyXkEyXkFqcGdeQXVyNDk3NzU2MTQ@._V1_UX67_CR0,0,67,98_AL_.jpg",The Truman Show,1998,U,103 min,"Comedy, Drama",8.1,An insurance salesman discovers his whole life is actually a reality TV show.,90.0,Peter Weir,Jim Carrey,Ed Harris,Laura Linney,Noah Emmerich,939631,125618201,Andrew Niccol,7.78,1429.0
254,"https://m.media-amazon.com/images/M/MV5BMzA5Zjc3ZTMtMmU5YS00YTMwLWI4MWUtYTU0YTVmNjVmODZhXkEyXkFqcGdeQXVyNjU0OTQ0OTY@._V1_UX67_CR0,0,67,98_AL_.jpg",Trainspotting,1996,A,93 min,Drama,8.1,"Renton, deeply immersed in the Edinburgh drug scene, tries to clean up and get out, despite the allure of the drugs and influence of friends.",83.0,Danny Boyle,Ewan McGregor,Ewen Bremner,Jonny Lee Miller,Kevin McKidd,634716,16501785,Irvine Welsh,8.18,160196.0
256,"https://m.media-amazon.com/images/M/MV5BNzI4YTVmMWEtMWQ3MS00OGE1LWE5YjMtNjc4NWJmYjRmZTQyXkEyXkFqcGdeQXVyNTA4NzY1MzY@._V1_UY98_CR0,0,67,98_AL_.jpg",Underground,1995,,170 min,"Comedy, Drama, War",8.1,"A group of Serbian socialists prepares for the war in a surreal underground filled by parties, tragedies, love and hate.",,Emir Kusturica,Predrag 'Miki' Manojlovic,Lazar Ristovski,Mirjana Jokovic,Slavko Stimac,55220,171082,Colson Whitehead,8.1,369805.0
257,"https://m.media-amazon.com/images/M/MV5BNDNiOTA5YjktY2Q0Ni00ODgzLWE5MWItNGExOWRlYjY2MjBlXkEyXkFqcGdeQXVyNjQ2MjQ5NzM@._V1_UY98_CR1,0,67,98_AL_.jpg",La haine,1995,UA,98 min,"Crime, Drama",8.1,24 hours in the lives of three young men in the French suburbs the day after a violent riot.,,Mathieu Kassovitz,Vincent Cassel,Hubert Koundé,Saïd Taghmaoui,Abdel Ahmed Ghili,150345,309811,Barbara Abel,7.94,894.0
258,"https://m.media-amazon.com/images/M/MV5BYmNjYzRlM2YtZTZjZC00ODVmLTljZWMtODg1YmYyNDBiNzU3XkEyXkFqcGdeQXVyNTkzNDQ4ODc@._V1_UY98_CR3,0,67,98_AL_.jpg",Dilwale Dulhania Le Jayenge,1995,U,189 min,"Drama, Romance",8.1,"When Raj meets Simran in Europe, it isn't love at first sight but when Simran moves to India for an arranged marriage, love makes its presence felt.",,Aditya Chopra,Shah Rukh Khan,Kajol,Amrish Puri,Farida Jalal,63516,,Aditya Chopra,8.86,46.0
259,"https://m.media-amazon.com/images/M/MV5BZDdiZTAwYzAtMDI3Ni00OTRjLTkzN2UtMGE3MDMyZmU4NTU4XkEyXkFqcGdeQXVyNjU0OTQ0OTY@._V1_UX67_CR0,0,67,98_AL_.jpg",Before Sunrise,1995,R,101 min,"Drama, Romance",8.1,"A young man and woman meet on a train in Europe, and wind up spending one evening together in Vienna. Unfortunately, both know that this will probably be their only night together.",77.0,Richard Linklater,Ethan Hawke,Julie Delpy,Andrea Eckert,Hanno Pöschl,272291,5535405,Tiffany Schmidt,7.72,3127.0
260,"https://m.media-amazon.com/images/M/MV5BYTg1MmNiMjItMmY4Yy00ZDQ3LThjMzYtZGQ0ZTQzNTdkMGQ1L2ltYWdlL2ltYWdlXkEyXkFqcGdeQXVyMTQxNzMzNDI@._V1_UX67_CR0,0,67,98_AL_.jpg",Trois couleurs: Rouge,1994,U,99 min,"Drama, Mystery, Romance",8.1,A model discovers a retired judge is keen on invading people's privacy.,100.0,Krzysztof Kieslowski,Irène Jacob,Jean-Louis Trintignant,Frédérique Feder,Jean-Pierre Lorit,90729,4043686,Krzysztof Kieślowski,8.7,34.0
262,"https://m.media-amazon.com/images/M/MV5BMjM2MDgxMDg0Nl5BMl5BanBnXkFtZTgwNTM2OTM5NDE@._V1_UX67_CR0,0,67,98_AL_.jpg",Jurassic Park,1993,UA,127 min,"Action, Adventure, Sci-Fi",8.1,A pragmatic paleontologist visiting an almost complete theme park is tasked with protecting a couple of kids after a power failure causes the park's cloned dinosaurs to run loose.,68.0,Steven Spielberg,Sam Neill,Laura Dern,Jeff Goldblum,Richard Attenborough,867615,402453882,Michael Crichton,8.16,901088.0
263,"https://m.media-amazon.com/images/M/MV5BMmYyOTgwYWItYmU3Ny00M2E2LTk0NWMtMDVlNmQ0MWZiMTMxXkEyXkFqcGdeQXVyNzkwMjQ5NzM@._V1_UX67_CR0,0,67,98_AL_.jpg",In the Name of the Father,1993,UA,133 min,"Biography, Crime, Drama",8.1,A man's coerced confession to an I.R.A. bombing he did not commit results in the imprisonment of his father as well. An English lawyer fights to free them.,84.0,Jim Sheridan,Daniel Day-Lewis,Pete Postlethwaite,Alison Crosbie,Philip King,156842,25010410,Morticia Knight,7.82,1308.0
266,"https://m.media-amazon.com/images/M/MV5BOGYwYWNjMzgtNGU4ZC00NWQ2LWEwZjUtMzE1Zjc3NjY3YTU1XkEyXkFqcGdeQXVyMTQxNzMzNDI@._V1_UX67_CR0,0,67,98_AL_.jpg",Dead Poets Society,1989,U,128 min,"Comedy, Drama",8.1,Maverick teacher John Keating uses poetry to embolden his boarding school students to new heights of self-expression.,79.0,Peter Weir,Robin Williams,Robert Sean Leonard,Ethan Hawke,Josh Charles,425457,95860116,N.H. Kleinbaum,8.4,81364.0
267,"https://m.media-amazon.com/images/M/MV5BODJmY2Y2OGQtMDg2My00N2Q3LWJmZTUtYTc2ODBjZDVlNDlhXkEyXkFqcGdeQXVyMTQxNzMzNDI@._V1_UX67_CR0,0,67,98_AL_.jpg",Stand by Me,1986,U,89 min,"Adventure, Drama",8.1,"After the death of one of his friends, a writer recounts a childhood journey with his friends to find the body of a missing boy.",75.0,Rob Reiner,Wil Wheaton,River Phoenix,Corey Feldman,Jerry O'Connell,363401,52287414,S.R. Grey,7.38,1370.0
271,"https://m.media-amazon.com/images/M/MV5BNGViZWZmM2EtNGYzZi00ZDAyLTk3ODMtNzIyZTBjN2Y1NmM1XkEyXkFqcGdeQXVyNTAyODkwOQ@@._V1_UX67_CR0,0,67,98_AL_.jpg",The Thing,1982,A,109 min,"Horror, Mystery, Sci-Fi",8.1,A research team in Antarctica is hunted by a shape-shifting alien that assumes the appearance of its victims.,57.0,John Carpenter,Kurt Russell,Wilford Brimley,Keith David,Richard Masur,371271,13782838,Laura Dave,7.74,617065.0
272,"https://m.media-amazon.com/images/M/MV5BZDhlZTYxOTYtYTk3Ny00ZDljLTk3ZmItZTcxZWU5YTIyYmFkXkEyXkFqcGdeQXVyMTQxNzMzNDI@._V1_UX67_CR0,0,67,98_AL_.jpg",Pink Floyd: The Wall,1982,UA,95 min,"Drama, Fantasy, Music",8.1,A confined but troubled rock star descends into madness in the midst of his physical and social isolation from everyone.,47.0,Alan Parker,Bob Geldof,Christine Hargreaves,James Laurenson,Eleanor David,76081,22244207,Gerald Scarfe,9.02,206.0
274,"https://m.media-amazon.com/images/M/MV5BZmQzMDE5ZWQtOTU3ZS00ZjdhLWI0OTctZDNkODk4YThmOTRhL2ltYWdlXkEyXkFqcGdeQXVyNjc1NTYyMjg@._V1_UX67_CR0,0,67,98_AL_.jpg",Fanny och Alexander,1982,A,188 min,Drama,8.1,"Two young Swedish children experience the many comedies and tragedies of their family, the Ekdahls.",100.0,Ingmar Bergman,Bertil Guve,Pernilla Allwin,Kristina Adolphson,Börje Ahlstedt,57784,4971340,Ingmar Bergman,7.98,490.0
276,"https://m.media-amazon.com/images/M/MV5BMDVjNjIwOGItNDE3Ny00OThjLWE0NzQtZTU3YjMzZTZjMzhkXkEyXkFqcGdeQXVyMTQxNzMzNDI@._V1_UX67_CR0,0,67,98_AL_.jpg",The Elephant Man,1980,UA,124 min,"Biography, Drama",8.1,"A Victorian surgeon rescues a heavily disfigured man who is mistreated while scraping a living as a side-show freak. Behind his monstrous façade, there is revealed a person of kindness, intelligence and sophistication.",78.0,David Lynch,Anthony Hopkins,John Hurt,Anne Bancroft,John Gielgud,220078,,Bernard Pomerance,8.22,10776.0
280,"https://m.media-amazon.com/images/M/MV5BZGNjYjM2MzItZGQzZi00NmY3LTgxOGUtMTQ2MWQxNWQ2MmMwXkEyXkFqcGdeQXVyNzM0MTUwNTY@._V1_UX67_CR0,0,67,98_AL_.jpg",Network,1976,UA,121 min,Drama,8.1,A television network cynically exploits a deranged former anchor's ravings and revelations about the news media for its own profit.,83.0,Sidney Lumet,Faye Dunaway,William Holden,Peter Finch,Robert Duvall,144911,,Kate Quinn,8.62,400615.0
281,"https://m.media-amazon.com/images/M/MV5BNmY0MWY2NDctZDdmMi00MjA1LTk0ZTQtZDMyZTQ1NTNlYzVjXkEyXkFqcGdeQXVyMjUzOTY1NTc@._V1_UX67_CR0,0,67,98_AL_.jpg",Barry Lyndon,1975,PG,185 min,"Adventure, Drama, History",8.1,An Irish rogue wins the heart of a rich widow and assumes her dead husband's aristocratic position in 18th-century England.,89.0,Stanley Kubrick,Ryan O'Neal,Marisa Berenson,Patrick Magee,Hardy Krüger,149843,,William Makepeace Thackeray,7.28,2281.0
283,"https://m.media-amazon.com/images/M/MV5BOGMwYmY5ZmEtMzY1Yi00OWJiLTk1Y2MtMzI2MjBhYmZkNTQ0XkEyXkFqcGdeQXVyNzkwMjQ5NzM@._V1_UX67_CR0,0,67,98_AL_.jpg",Chinatown,1974,UA,130 min,"Drama, Mystery, Thriller",8.1,"A private detective hired to expose an adulterer finds himself caught up in a web of deceit, corruption, and murder.",92.0,Roman Polanski,Jack Nicholson,Faye Dunaway,John Huston,Perry Lopez,294230,29000000,Charles Yu,7.98,49080.0
284,"https://m.media-amazon.com/images/M/MV5BOWVmYzQwY2MtOTBjNi00MDNhLWI5OGMtN2RiMDYxODI3MjU5XkEyXkFqcGdeQXVyMjUzOTY1NTc@._V1_UX67_CR0,0,67,98_AL_.jpg",Paper Moon,1973,U,102 min,"Comedy, Crime, Drama",8.1,"During the Great Depression, a con man finds himself saddled with a young girl who may or may not be his daughter, and the two forge an unlikely partnership.",77.0,Peter Bogdanovich,Ryan O'Neal,Tatum O'Neal,Madeline Kahn,John Hillerman,42285,30933743,Andrea Camilleri,8.02,5683.0
286,"https://m.media-amazon.com/images/M/MV5BZmY4Yjc0OWQtZDRhMy00ODc2LWI2NGYtMWFlODYyN2VlNDQyXkEyXkFqcGdeQXVyNjU0OTQ0OTY@._V1_UY98_CR1,0,67,98_AL_.jpg",Solaris,1972,PG,167 min,"Drama, Mystery, Sci-Fi",8.1,A psychologist is sent to a station orbiting a distant planet in order to discover what has caused the crew to go insane.,90.0,Andrei Tarkovsky,Natalya Bondarchuk,Donatas Banionis,Jüri Järvet,Vladislav Dvorzhetskiy,81021,,Stanisław Lem,8.0,92833.0
287,"https://m.media-amazon.com/images/M/MV5BMWFjZjRiM2QtZmRkOC00MDUxLTlhYmQtYmY5ZTNiMTI5Nzc2L2ltYWdlXkEyXkFqcGdeQXVyNTAyODkwOQ@@._V1_UX67_CR0,0,67,98_AL_.jpg",Le samouraï,1967,GP,105 min,"Crime, Drama, Mystery",8.1,After professional hitman Jef Costello is seen by witnesses his efforts to provide himself an alibi drive him further into a corner.,,Jean-Pierre Melville,Alain Delon,François Périer,Nathalie Delon,Cathy Rosier,45434,39481,Neal Stephenson,8.06,264316.0
288,"https://m.media-amazon.com/images/M/MV5BOWFlNzZhYmYtYTI5YS00MDQyLWIyNTUtNTRjMWUwNTEzNjA0XkEyXkFqcGdeQXVyNjUwNzk3NDc@._V1_UX67_CR0,0,67,98_AL_.jpg",Cool Hand Luke,1967,A,127 min,"Crime, Drama",8.1,"A laid back Southern man is sentenced to two years in a rural prison, but refuses to conform.",92.0,Stuart Rosenberg,Paul Newman,George Kennedy,Strother Martin,J.D. Cannon,161984,16217773,Donn Pearce,8.3,1273.0
290,"https://m.media-amazon.com/images/M/MV5BNjM2MjMwNzUzN15BMl5BanBnXkFtZTgwMjEzMzE5MTE@._V1_UY98_CR2,0,67,98_AL_.jpg",Andrei Rublev,1966,R,205 min,"Biography, Drama, History",8.1,"The life, times and afflictions of the fifteenth-century Russian iconographer St. Andrei Rublev.",,Andrei Tarkovsky,Anatoliy Solonitsyn,Ivan Lapikov,Nikolay Grinko,Nikolay Sergeev,46947,102021,Andrei Tarkovsky,8.62,77.0
292,"https://m.media-amazon.com/images/M/MV5BZTg3M2ExY2EtZmI5Yy00YWM1LTg4NzItZWEzZTgxNzE2MjhhXkEyXkFqcGdeQXVyNDE5MTU2MDE@._V1_UX67_CR0,0,67,98_AL_.jpg",El ángel exterminador,1962,,95 min,"Drama, Fantasy",8.1,The guests at an upper-class dinner party find themselves unable to leave.,,Luis Buñuel,Silvia Pinal,Jacqueline Andere,Enrique Rambal,José Baviera,29682,,Antonio Rittscher,6.0,2.0
293,"https://m.media-amazon.com/images/M/MV5BZmI0M2VmNTgtMWVhYS00Zjg1LTk1YTYtNmJmMjRkZmMwYTc2XkEyXkFqcGdeQXVyNTA4NzY1MzY@._V1_UX67_CR0,0,67,98_AL_.jpg",What Ever Happened to Baby Jane?,1962,Passed,134 min,"Drama, Horror, Thriller",8.1,A former child star torments her paraplegic sister in their decaying Hollywood mansion.,75.0,Robert Aldrich,Bette Davis,Joan Crawford,Victor Buono,Wesley Addy,50058,4050000,Henry Farrell,7.9,4265.0
295,"https://m.media-amazon.com/images/M/MV5BMGEyNzhkYzktMGMyZS00YzRiLWJlYjktZjJkOTU5ZDY0ZGI4XkEyXkFqcGdeQXVyNjUwNzk3NDc@._V1_UX67_CR0,0,67,98_AL_.jpg",The Man Who Shot Liberty Valance,1962,,123 min,"Drama, Western",8.1,A senator returns to a western town for the funeral of an old friend and tells the story of his origins.,94.0,John Ford,James Stewart,John Wayne,Vera Miles,Lee Marvin,68827,,Dorothy M. Johnson,7.76,172.0
298,"https://m.media-amazon.com/images/M/MV5BMGQ5ODNkNWYtYTgxZS00YjJkLThhODAtYzUwNGNiYjRmNjdkXkEyXkFqcGdeQXVyMTg2NTc4MzA@._V1_UY98_CR4,0,67,98_AL_.jpg",Inherit the Wind,1960,Passed,128 min,"Biography, Drama, History",8.1,"Based on a real-life case in 1925, two great lawyers argue the case for and against a science teacher accused of the crime of teaching evolution.",75.0,Stanley Kramer,Spencer Tracy,Fredric March,Gene Kelly,Dick York,27254,,Jerome Lawrence,7.88,22809.0
299,"https://m.media-amazon.com/images/M/MV5BYTQ4MjA4NmYtYjRhNi00MTEwLTg0NjgtNjk3ODJlZGU4NjRkL2ltYWdlL2ltYWdlXkEyXkFqcGdeQXVyNjU0OTQ0OTY@._V1_UY98_CR3,0,67,98_AL_.jpg",Les quatre cents coups,1959,,99 min,"Crime, Drama",8.1,"A young boy, left without attention, delves into a life of petty crime.",,François Truffaut,Jean-Pierre Léaud,Albert Rémy,Claire Maurier,Guy Decomble,105291,,Marcel Moussy,9.0,2.0
303,"https://m.media-amazon.com/images/M/MV5BNGYxZjA2M2ItYTRmNS00NzRmLWJkYzgtYTdiNGFlZDI5ZjNmXkEyXkFqcGdeQXVyNDE5MTU2MDE@._V1_UY98_CR0,0,67,98_AL_.jpg",Kumonosu-jô,1957,,110 min,"Drama, History",8.1,"A war-hardened general, egged on by his ambitious wife, works to fulfill a prophecy that he would become lord of Spider's Web Castle.",,Akira Kurosawa,Toshirô Mifune,Minoru Chiaki,Isuzu Yamada,Takashi Shimura,46678,,dewakensyozouko,0.0,0.0
304,"https://m.media-amazon.com/images/M/MV5BMGVhNjhjODktODgxYS00MDdhLTlkZjktYTkyNzQxMTU0ZDYxXkEyXkFqcGdeQXVyNzkwMjQ5NzM@._V1_UX67_CR0,0,67,98_AL_.jpg",The Bridge on the River Kwai,1957,PG,161 min,"Adventure, Drama, War",8.1,"British POWs are forced to build a railway bridge across the river Kwai for their Japanese captors, not knowing that the allied forces are planning to destroy it.",87.0,David Lean,William Holden,Alec Guinness,Jack Hawkins,Sessue Hayakawa,203463,44908000,Pierre Boulle,7.94,9090.0
305,"https://m.media-amazon.com/images/M/MV5BY2I0MWFiZDMtNWQyYy00Njk5LTk3MDktZjZjNTNmZmVkYjkxXkEyXkFqcGdeQXVyNjc1NTYyMjg@._V1_UX67_CR0,0,67,98_AL_.jpg",On the Waterfront,1954,A,108 min,"Crime, Drama, Thriller",8.1,An ex-prize fighter turned longshoreman struggles to stand up to his corrupt union bosses.,91.0,Elia Kazan,Marlon Brando,Karl Malden,Lee J. Cobb,Rod Steiger,142107,9600000,Mike McCoy,9.6,5.0
306,"https://m.media-amazon.com/images/M/MV5BZDdkNzMwZmUtY2Q5MS00ZmM2LWJhYjItYTBjMWY0MGM4MDRjXkEyXkFqcGdeQXVyNTA4NzY1MzY@._V1_UY98_CR0,0,67,98_AL_.jpg",Le salaire de la peur,1953,U,131 min,"Adventure, Drama, Thriller",8.1,"In a decrepit South American village, four men are hired to transport an urgent nitroglycerine shipment without the equipment that would make it safe.",85.0,Henri-Georges Clouzot,Yves Montand,Charles Vanel,Peter van Eyck,Folco Lulli,54588,,Georges Arnaud,7.22,382.0
307,"https://m.media-amazon.com/images/M/MV5BNDUzZjlhZTYtN2E5MS00ODQ3LWI1ZjgtNzdiZmI0NTZiZTljXkEyXkFqcGdeQXVyMjI4MjA5MzA@._V1_UX67_CR0,0,67,98_AL_.jpg",Ace in the Hole,1951,Approved,111 min,"Drama, Film-Noir",8.1,"A frustrated former big-city journalist now stuck working for an Albuquerque newspaper exploits a story about a man trapped in a cave to rekindle his career, but the situation quickly escalates into an out-of-control circus.",72.0,Billy Wilder,Kirk Douglas,Jan Sterling,Robert Arthur,Porter Hall,31568,3969893,Annie Proulx,7.56,5481.0
308,"https://m.media-amazon.com/images/M/MV5BZmI5NTA3MjItYzdhMi00MWMxLTg3OWMtYWQyYjg5MTFmM2U0L2ltYWdlL2ltYWdlXkEyXkFqcGdeQXVyNjc1NTYyMjg@._V1_UX67_CR0,0,67,98_AL_.jpg",White Heat,1949,,114 min,"Action, Crime, Drama",8.1,A psychopathic criminal with a mother complex makes a daring break from prison and leads his old gang in a chemical plant payroll heist.,,Raoul Walsh,James Cagney,Virginia Mayo,Edmond O'Brien,Margaret Wycherly,29807,,Autumn Jones Lake,8.94,3023.0
309,"https://m.media-amazon.com/images/M/MV5BYjE2OTdhMWUtOGJlMy00ZDViLWIzZjgtYjZkZGZmMDZjYmEyXkEyXkFqcGdeQXVyNzkwMjQ5NzM@._V1_UX67_CR0,0,67,98_AL_.jpg",The Third Man,1949,Approved,104 min,"Film-Noir, Mystery, Thriller",8.1,"Pulp novelist Holly Martins travels to shadowy, postwar Vienna, only to find himself investigating the mysterious death of an old friend, Harry Lime.",97.0,Carol Reed,Orson Welles,Joseph Cotten,Alida Valli,Trevor Howard,158731,449191,Graham Greene,7.6,13864.0
310,"https://m.media-amazon.com/images/M/MV5BOWRmNGEwZjUtZjEwNS00OGZmLThhMmEtZTJlMTU5MGQ3ZWUwXkEyXkFqcGdeQXVyNjc1NTYyMjg@._V1_UX67_CR0,0,67,98_AL_.jpg",The Red Shoes,1948,,135 min,"Drama, Music, Romance",8.1,A young ballet dancer is torn between the man she loves and her pursuit to become a prima ballerina.,,Michael Powell,Emeric Pressburger,Anton Walbrook,Marius Goring,Moira Shearer,30935,10900000,Hans Christian Andersen,7.12,1508.0
311,"https://m.media-amazon.com/images/M/MV5BNzc1MTcyNTQ5N15BMl5BanBnXkFtZTgwMzgwMDI0MjE@._V1_UX67_CR0,0,67,98_AL_.jpg",The Shop Around the Corner,1940,,99 min,"Comedy, Drama, Romance",8.1,"Two employees at a gift shop can barely stand each other, without realizing that they are falling in love through the post as each other's anonymous pen pal.",96.0,Ernst Lubitsch,Margaret Sullavan,James Stewart,Frank Morgan,Joseph Schildkraut,28450,203300,Anne-Marie Meyer,8.18,348.0
312,"https://m.media-amazon.com/images/M/MV5BYTcxYWExOTMtMWFmYy00ZjgzLWI0YjktNWEzYzJkZTg0NDdmL2ltYWdlXkEyXkFqcGdeQXVyNjc1NTYyMjg@._V1_UY98_CR0,0,67,98_AL_.jpg",Rebecca,1940,Approved,130 min,"Drama, Mystery, Romance",8.1,A self-conscious woman juggles adjusting to her new role as an aristocrat's wife and avoiding being intimidated by his first wife's spectral presence.,86.0,Alfred Hitchcock,Laurence Olivier,Joan Fontaine,George Sanders,Judith Anderson,123942,4360000,Daphne du Maurier,8.48,569751.0
313,"https://m.media-amazon.com/images/M/MV5BZTYwYjYxYzgtMDE1Ni00NzU4LWJlMTEtODQ5YmJmMGJhZjI5L2ltYWdlXkEyXkFqcGdeQXVyMDI2NDg0NQ@@._V1_UX67_CR0,0,67,98_AL_.jpg",Mr. Smith Goes to Washington,1939,Passed,129 min,"Comedy, Drama",8.1,"A naive man is appointed to fill a vacancy in the United States Senate. His plans promptly collide with political corruption, but he doesn't back down.",73.0,Frank Capra,James Stewart,Jean Arthur,Claude Rains,Edward Arnold,107017,9600000,Sidney Buchman,8.6,10.0
314,"https://m.media-amazon.com/images/M/MV5BYjUyZWZkM2UtMzYxYy00ZmQ3LWFmZTQtOGE2YjBkNjA3YWZlXkEyXkFqcGdeQXVyNzkwMjQ5NzM@._V1_UX67_CR0,0,67,98_AL_.jpg",Gone with the Wind,1939,U,238 min,"Drama, History, Romance",8.1,A manipulative woman and a roguish man conduct a turbulent romance during the American Civil War and Reconstruction periods.,97.0,Victor Fleming,George Cukor,Sam Wood,Clark Gable,Vivien Leigh,290074,198676459,Margaret Mitchell,8.6,1169491.0
315,"https://m.media-amazon.com/images/M/MV5BMTg3MTI5NTk0N15BMl5BanBnXkFtZTgwMjU1MDM5MTE@._V1_UY98_CR2,0,67,98_AL_.jpg",La Grande Illusion,1937,,113 min,"Drama, War",8.1,"During WWI, two French soldiers are captured and imprisoned in a German P.O.W. camp. Several escape attempts follow until they are eventually sent to a seemingly inescapable fortress.",,Jean Renoir,Jean Gabin,Dita Parlo,Pierre Fresnay,Erich von Stroheim,33829,172885,Michel Barnier,7.8,157.0
316,"https://m.media-amazon.com/images/M/MV5BYzJmMWE5NjAtNWMyZS00NmFiLWIwMDgtZDE2NzczYWFhNzIzXkEyXkFqcGdeQXVyNjc1NTYyMjg@._V1_UX67_CR0,0,67,98_AL_.jpg",It Happened One Night,1934,Approved,105 min,"Comedy, Romance",8.1,"A renegade reporter and a crazy young heiress meet on a bus heading for New York, and end up stuck with each other when the bus leaves them behind at one of the stops.",87.0,Frank Capra,Clark Gable,Claudette Colbert,Walter Connolly,Roscoe Karns,94016,4360000,Stephanie Laurens,7.82,3166.0
317,"https://m.media-amazon.com/images/M/MV5BNjBjNDJiYTUtOWY0OS00OGVmLTg2YzctMTE0NzVhODM1ZWJmXkEyXkFqcGdeQXVyNjU0OTQ0OTY@._V1_UX67_CR0,0,67,98_AL_.jpg",La passion de Jeanne d'Arc,1928,Passed,110 min,"Biography, Drama, History",8.1,"In 1431, Jeanne d'Arc is placed on trial on charges of heresy. The ecclesiastical jurists attempt to force Jeanne to recant her claims of holy visions.",,Carl Theodor Dreyer,Maria Falconetti,Eugene Silvain,André Berley,Maurice Schutz,47676,21877,Carl Theodor Dreyer,9.0,4.0
319,"https://m.media-amazon.com/images/M/MV5BNDVkYmYwM2ItNzRiMy00NWQ4LTlhMjMtNDI1ZDYyOGVmMzJjXkEyXkFqcGdeQXVyNTgzMzU5MDI@._V1_UX67_CR0,0,67,98_AL_.jpg",Sunrise: A Song of Two Humans,1927,Passed,94 min,"Drama, Romance",8.1,An allegorical tale about a man fighting the good and evil within him. Both sides are made flesh - one a sophisticated woman he is attracted to and the other his wife.,,F.W. Murnau,George O'Brien,Janet Gaynor,Margaret Livingston,Bodil Rosing,46865,539540,Lucy Fischer,7.54,52.0
320,"https://m.media-amazon.com/images/M/MV5BYmRiMDFlYjYtOTMwYy00OGY2LWE0Y2QtYzQxOGNhZmUwNTIxXkEyXkFqcGdeQXVyNzkwMjQ5NzM@._V1_UX67_CR0,0,67,98_AL_.jpg",The General,1926,Passed,67 min,"Action, Adventure, Comedy",8.1,"When Union spies steal an engineer's beloved locomotive, he pursues it single-handedly and straight through enemy lines.",,Clyde Bruckman,Buster Keaton,Buster Keaton,Marion Mack,Glen Cavender,81156,1033895,Nelson DeMille,8.2,62669.0
321,"https://m.media-amazon.com/images/M/MV5BNWJiNGJiMTEtMGM3OC00ZWNlLTgwZTgtMzdhNTRiZjk5MTQ1XkEyXkFqcGdeQXVyMTMxODk2OTU@._V1_UY98_CR1,0,67,98_AL_.jpg",Das Cabinet des Dr. Caligari,1920,,76 min,"Fantasy, Horror, Mystery",8.1,"Hypnotist Dr. Caligari uses a somnambulist, Cesare, to commit murders.",,Robert Wiene,Werner Krauss,Conrad Veidt,Friedrich Feher,Lil Dagover,57428,,David Robinson,7.46,73.0
323,"https://m.media-amazon.com/images/M/MV5BNjJkYTc5N2UtMGRlMC00M2FmLTk0ZWMtOTYxNDUwNjI2YzljXkEyXkFqcGdeQXVyNDg4NjY5OTQ@._V1_UX67_CR0,0,67,98_AL_.jpg",Togo,2019,U,113 min,"Adventure, Biography, Drama",8.0,"The story of Togo, the sled dog who led the 1925 serum run yet was considered by most to be too small and weak to lead such an intense race.",69.0,Ericson Core,Willem Dafoe,Julianne Nicholson,Christopher Heyerdahl,Richard Dormer,37556,,Kate Klimo,8.8,441.0
325,"https://m.media-amazon.com/images/M/MV5BMjE1NjQ5ODc2NV5BMl5BanBnXkFtZTgwOTM5ODIxNjE@._V1_UY98_CR0,0,67,98_AL_.jpg",Bajrangi Bhaijaan,2015,UA,163 min,"Action, Adventure, Comedy",8.0,An Indian man with a magnanimous heart takes a young mute Pakistani girl back to her homeland to reunite her with her family.,,Kabir Khan,Salman Khan,Harshaali Malhotra,Nawazuddin Siddiqui,Kareena Kapoor,72245,8178001,Tanvi Bhat,9.34,3.0
326,"https://m.media-amazon.com/images/M/MV5BYTdhNjBjZDctYTlkYy00ZGIxLWFjYTktODk5ZjNlMzI4NjI3XkEyXkFqcGdeQXVyMjY1MjkzMjE@._V1_UY98_CR0,0,67,98_AL_.jpg",Baby,2015,UA,159 min,"Action, Crime, Thriller",8.0,"An elite counter-intelligence unit learns of a plot, masterminded by a maniacal madman. With the clock ticking, it's up to them to track the terrorists' international tentacles and prevent them from striking at the heart of India.",,Neeraj Pandey,Akshay Kumar,Danny Denzongpa,Rana Daggubati,Taapsee Pannu,52848,,Emily Giffin,7.5,163038.0
329,"https://m.media-amazon.com/images/M/MV5BMTc2MTQ3MDA1Nl5BMl5BanBnXkFtZTgwODA3OTI4NjE@._V1_UX67_CR0,0,67,98_AL_.jpg",The Martian,2015,UA,144 min,"Adventure, Drama, Sci-Fi",8.0,"An astronaut becomes stranded on Mars after his team assume him dead, and must rely on his ingenuity to find a way to signal to Earth that he is alive.",80.0,Ridley Scott,Matt Damon,Jessica Chastain,Kristen Wiig,Kate Mara,760094,228433663,Andy Weir,8.82,1011850.0
330,"https://m.media-amazon.com/images/M/MV5BOTMyMjEyNzIzMV5BMl5BanBnXkFtZTgwNzIyNjU0NzE@._V1_UX67_CR0,0,67,98_AL_.jpg",Zootopia,2016,U,108 min,"Animation, Adventure, Comedy",8.0,"In a city of anthropomorphic animals, a rookie bunny cop and a cynical con artist fox must work together to uncover a conspiracy.",78.0,Byron Howard,Rich Moore,Jared Bush,Ginnifer Goodwin,Jason Bateman,434143,341268248,Jessica Julius,9.02,757.0
333,"https://m.media-amazon.com/images/M/MV5BYjFhOWY0OTgtNDkzMC00YWJkLTk1NGEtYWUxNjhmMmQ5ZjYyXkEyXkFqcGdeQXVyMjMxOTE0ODA@._V1_UX67_CR0,0,67,98_AL_.jpg",Wonder,2017,U,113 min,"Drama, Family",8.0,"Based on the New York Times bestseller, this movie tells the incredibly inspiring and heartwarming story of August Pullman, a boy with facial differences who enters the fifth grade, attending a mainstream elementary school for the first time.",66.0,Stephen Chbosky,Jacob Tremblay,Owen Wilson,Izabela Vidovic,Julia Roberts,141923,132422809,R.J. Palacio,8.78,991897.0
336,"https://m.media-amazon.com/images/M/MV5BMTEwNjE2OTM4NDZeQTJeQWpwZ15BbWU3MDE2MTE4OTk@._V1_UX67_CR0,0,67,98_AL_.jpg",Short Term 12,2013,R,96 min,Drama,8.0,A 20-something supervising staff member of a residential treatment facility navigates the troubled waters of that world alongside her co-worker and longtime boyfriend.,82.0,Destin Daniel Cretton,Brie Larson,Frantz Turner,John Gallagher Jr.,Kaitlyn Dever,81770,1010414,Destin Daniel Cretton,8.12,16.0
338,"https://m.media-amazon.com/images/M/MV5BOTgwMzFiMWYtZDhlNS00ODNkLWJiODAtZDVhNzgyNzJhYjQ4L2ltYWdlXkEyXkFqcGdeQXVyNzEzOTYxNTQ@._V1_UX67_CR0,0,67,98_AL_.jpg",The Imitation Game,2014,UA,114 min,"Biography, Drama, Thriller",8.0,"During World War II, the English mathematical genius Alan Turing tries to crack the German Enigma code with help from fellow mathematicians.",73.0,Morten Tyldum,Benedict Cumberbatch,Keira Knightley,Matthew Goode,Allen Leech,685201,91125683,Jim Ottaviani,7.26,1518.0
340,"https://m.media-amazon.com/images/M/MV5BNzA1Njg4NzYxOV5BMl5BanBnXkFtZTgwODk5NjU3MzI@._V1_UX67_CR0,0,67,98_AL_.jpg",Blade Runner 2049,2017,UA,164 min,"Action, Drama, Mystery",8.0,"Young Blade Runner K's discovery of a long-buried secret leads him to track down former Blade Runner Rick Deckard, who's been missing for thirty years.",81.0,Denis Villeneuve,Harrison Ford,Ryan Gosling,Ana de Armas,Dave Bautista,461823,92054159,Tanya Lapointe,9.18,276.0
342,"https://m.media-amazon.com/images/M/MV5BMTA2NDc3Njg5NDVeQTJeQWpwZ15BbWU4MDc1NDcxNTUz._V1_UX67_CR0,0,67,98_AL_.jpg",Bohemian Rhapsody,2018,UA,134 min,"Biography, Drama, Music",8.0,"The story of the legendary British rock band Queen and lead singer Freddie Mercury, leading up to their famous performance at Live Aid (1985).",49.0,Bryan Singer,Rami Malek,Lucy Boynton,Gwilym Lee,Ben Hardy,450349,216428042,Mike Dawson,7.04,533.0
