,Poster_Link,Series_Title,Released_Year,Certificate,Runtime,Genre,IMDB_Rating,Overview,Meta_score,Director,Star1,Star2,Star3,Star4,No_of_Votes,Gross,Autor_libro,Nota_promedio_libro,Votos_libro
667,"https://m.media-amazon.com/images/M/MV5BOGNmMjBmZWEtOWYwZC00NGIzLTg0YWItMzkzMWMwOTU4YTViXkEyXkFqcGdeQXVyNzc5MjA3OA@@._V1_UX67_CR0,0,67,98_AL_.jpg",Night on Earth,1991,R,129 min,"Comedy, Drama",7.8,An anthology of 5 different cab drivers in 5 American and European cities and their remarkable fares on the same eventful night.,68.0,Jim Jarmusch,Winona Ryder,Gena Rowlands,Lisanne Falk,Alan Randolph Scott,55362,2015810,Warren Ellis,7.82,1288.0
668,"https://m.media-amazon.com/images/M/MV5BYmE0ZGRiMDgtOTU0ZS00YWUwLTk5YWQtMzhiZGVhNzViMGZiXkEyXkFqcGdeQXVyMTMxODk2OTU@._V1_UX67_CR0,0,67,98_AL_.jpg",La double vie de Véronique,1991,R,98 min,"Drama, Fantasy, Music",7.8,"Two parallel stories about two identical women; one living in Poland, the other in France. They don't know each other, but their lives are nevertheless profoundly connected.",86.0,Krzysztof Kieslowski,Irène Jacob,Wladyslaw Kowalski,Halina Gryglaszewska,Kalina Jedrusik,42376,1999955,Krzysztof Kieślowski,7.8,102.0
670,"https://m.media-amazon.com/images/M/MV5BNzY0ODQ3MTMxN15BMl5BanBnXkFtZTgwMDkwNTg4NjE@._V1_UX67_CR0,0,67,98_AL_.jpg",Misery,1990,R,107 min,"Drama, Thriller",7.8,"After a famous author is rescued from a car crash by a fan of his novels, he comes to realize that the care he is receiving is only the beginning of a nightmare of captivity and abuse.",75.0,Rob Reiner,James Caan,Kathy Bates,Richard Farnsworth,Frances Sternhagen,184740,61276872,Stephen King,8.4,619992.0
673,"https://m.media-amazon.com/images/M/MV5BODhlNjA5MDEtZDVhNS00ZmM3LTg1YzAtZGRjNjhjNTAzNzVkXkEyXkFqcGdeQXVyNjUwMzI2NzU@._V1_UY98_CR0,0,67,98_AL_.jpg",Glory,1989,R,122 min,"Biography, Drama, History",7.8,"Robert Gould Shaw leads the U.S. Civil War's first all-black volunteer company, fighting prejudices from both his own Union Army, and the Confederates.",78.0,Edward Zwick,Matthew Broderick,Denzel Washington,Cary Elwes,Morgan Freeman,122779,26830000,J.D. Robb,8.54,60042.0
675,"https://m.media-amazon.com/images/M/MV5BZTMxMGM5MjItNDJhNy00MWI2LWJlZWMtOWFhMjI5ZTQwMWM3XkEyXkFqcGdeQXVyMTQxNzMzNDI@._V1_UX67_CR0,0,67,98_AL_.jpg",Back to the Future Part II,1989,U,108 min,"Adventure, Comedy, Sci-Fi",7.8,"After visiting 2015, Marty McFly must repeat his visit to 1955 to prevent disastrous changes to 1985...without interfering with his first trip.",57.0,Robert Zemeckis,Michael J. Fox,Christopher Lloyd,Lea Thompson,Thomas F. Wilson,481918,118500000,Jill Wolf,7.86,14.0
676,"https://m.media-amazon.com/images/M/MV5BZTFjNjU4OTktYzljMS00MmFlLWI3NGEtNjNhMTYwYzUyZDgyL2ltYWdlL2ltYWdlXkEyXkFqcGdeQXVyNjU0OTQ0OTY@._V1_UX67_CR0,0,67,98_AL_.jpg",Mississippi Burning,1988,A,128 min,"Crime, Drama, History",7.8,Two F.B.I. Agents with wildly different styles arrive in Mississippi to investigate the disappearance of some civil rights activists.,65.0,Alan Parker,Gene Hackman,Willem Dafoe,Frances McDormand,Brad Dourif,88214,34603943,Kirk Mitchell,7.72,162.0
680,"https://m.media-amazon.com/images/M/MV5BM2ZmNDJiZTUtYjg5Zi00M2I3LTliZjAtNzQ4NTlkYTAzYTAxXkEyXkFqcGdeQXVyNTkyMDc0MjI@._V1_UX67_CR0,0,67,98_AL_.jpg",Down by Law,1986,R,107 min,"Comedy, Crime, Drama",7.8,"Two men are framed and sent to jail, where they meet a murderer who helps them escape and leave the state.",75.0,Jim Jarmusch,Tom Waits,John Lurie,Roberto Benigni,Nicoletta Braschi,47834,1436000,Ann B. Ross,8.0,2014.0
681,"https://m.media-amazon.com/images/M/MV5BODRlMjRkZGEtZWM2Zi00ZjYxLWE0MWUtMmM1YWM2NzZlOTE1XkEyXkFqcGdeQXVyMTQxNzMzNDI@._V1_UX67_CR0,0,67,98_AL_.jpg",The Goonies,1985,U,114 min,"Adventure, Comedy, Family",7.8,A group of young misfits called The Goonies discover an ancient map and set out on an adventure to find a legendary pirate's long-lost treasure.,62.0,Richard Donner,Sean Astin,Josh Brolin,Jeff Cohen,Corey Feldman,244430,61503218,James Kahn,8.28,1954.0
682,"https://m.media-amazon.com/images/M/MV5BZDRkOWQ5NGUtYTVmOS00ZjNhLWEwODgtOGI2MmUxNTBkMjU0XkEyXkFqcGdeQXVyMjUzOTY1NTc@._V1_UX67_CR0,0,67,98_AL_.jpg",The Color Purple,1985,U,154 min,Drama,7.8,A black Southern woman struggles to find her identity after suffering abuse from her father and others over four decades.,78.0,Steven Spielberg,Danny Glover,Whoopi Goldberg,Oprah Winfrey,Margaret Avery,78321,98467863,Alice Walker,8.5,620888.0
686,"https://m.media-amazon.com/images/M/MV5BOTUwMDA3MTYtZjhjMi00ODFmLTg5ZTAtYzgwN2NlODgzMmUwXkEyXkFqcGdeQXVyNjc1NTYyMjg@._V1_UX67_CR0,0,67,98_AL_.jpg",The Right Stuff,1983,PG,193 min,"Adventure, Biography, Drama",7.8,"The story of the original Mercury 7 astronauts and their macho, seat-of-the-pants approach to the space program.",91.0,Philip Kaufman,Sam Shepard,Scott Glenn,Ed Harris,Dennis Quaid,56235,21500000,Tom Wolfe,8.44,50478.0
688,"https://m.media-amazon.com/images/M/MV5BMTQ2ODFlMDAtNzdhOC00ZDYzLWE3YTMtNDU4ZGFmZmJmYTczXkEyXkFqcGdeQXVyMTQxNzMzNDI@._V1_UX67_CR0,0,67,98_AL_.jpg",E.T. the Extra-Terrestrial,1982,U,115 min,"Family, Sci-Fi",7.8,A troubled child summons the courage to help a friendly alien escape Earth and return to his home world.,91.0,Steven Spielberg,Henry Thomas,Drew Barrymore,Peter Coyote,Dee Wallace,372490,435110554,William Kotzwinkle,8.36,10934.0
689,"https://m.media-amazon.com/images/M/MV5BNDM3YjNlYmMtOGY3NS00MmRjLWIyY2UtNDA0MWM3OTNlZTY2XkEyXkFqcGdeQXVyMTQxNzMzNDI@._V1_UX67_CR0,0,67,98_AL_.jpg",Kramer vs. Kramer,1979,A,105 min,Drama,7.8,"Ted Kramer's wife leaves him, allowing for a lost bond to be rediscovered between Ted and his son, Billy. But a heated custody battle ensues over the divorced couple's son, deepening the wounds left by the separation.",77.0,Robert Benton,Dustin Hoffman,Meryl Streep,Jane Alexander,Justin Henry,133351,106260000,Avery Corman,7.7,2206.0
691,"https://m.media-amazon.com/images/M/MV5BMjIxNDYxMTk2MF5BMl5BanBnXkFtZTgwMjQxNjU3MTE@._V1_UY98_CR0,0,67,98_AL_.jpg",The Outlaw Josey Wales,1976,A,135 min,Western,7.8,Missouri farmer Josey Wales joins a Confederate guerrilla unit and winds up on the run from the Union soldiers who murdered his family.,69.0,Clint Eastwood,Clint Eastwood,Sondra Locke,Chief Dan George,Bill McKinney,65659,31800000,Forrest Carter,8.14,683.0
695,"https://m.media-amazon.com/images/M/MV5BNjZmMWE4NzgtZjc5OS00NTBmLThlY2MtM2MzNTA5NTZiNTFjXkEyXkFqcGdeQXVyNjc1NTYyMjg@._V1_UY98_CR0,0,67,98_AL_.jpg",The Day of the Jackal,1973,A,143 min,"Crime, Drama, Thriller",7.8,"A professional assassin codenamed ""Jackal"" plots to kill Charles de Gaulle, the President of France.",80.0,Fred Zinnemann,Edward Fox,Terence Alexander,Michel Auclair,Alan Badel,37445,16056255,Frederick Forsyth,8.52,130062.0
698,"https://m.media-amazon.com/images/M/MV5BZTllNDU0ZTItYTYxMC00OTI4LThlNDAtZjNiNzdhMWZiYjNmXkEyXkFqcGdeQXVyNzY1NDgwNjQ@._V1_UX67_CR0,0,67,98_AL_.jpg",Willy Wonka & the Chocolate Factory,1971,U,100 min,"Family, Fantasy, Musical",7.8,A poor but hopeful boy seeks one of the five coveted golden tickets that will send him on a tour of Willy Wonka's mysterious chocolate factory.,67.0,Mel Stuart,Gene Wilder,Jack Albertson,Peter Ostrum,Roy Kinnear,178731,4000000,Julie Dawn Cole,6.88,1699.0
699,"https://m.media-amazon.com/images/M/MV5BNTgwZmIzMmYtZjE3Yy00NzgzLTgxNmUtNjlmZDlkMzlhOTJkXkEyXkFqcGdeQXVyNjUwNzk3NDc@._V1_UX67_CR0,0,67,98_AL_.jpg",Midnight Cowboy,1969,A,113 min,Drama,7.8,"A naive hustler travels from Texas to New York City to seek personal fortune, finding a new friend in the process.",79.0,John Schlesinger,Dustin Hoffman,Jon Voight,Sylvia Miles,John McGiver,101124,44785053,James Leo Herlihy,7.92,2482.0
700,"https://m.media-amazon.com/images/M/MV5BMTQyNTAzOTI3NF5BMl5BanBnXkFtZTcwNTM0Mjg0Mg@@._V1_UX67_CR0,0,67,98_AL_.jpg",Wait Until Dark,1967,,108 min,Thriller,7.8,A recently blinded woman is terrorized by a trio of thugs while they search for a heroin-stuffed doll they believe is in her apartment.,81.0,Terence Young,Audrey Hepburn,Alan Arkin,Richard Crenna,Efrem Zimbalist Jr.,27733,17550741,Frederick Knott,8.22,2133.0
701,"https://m.media-amazon.com/images/M/MV5BZTVmMTk2NjUtNjVjNC00OTcwLWE4OWEtNzA4Mjk1ZmIwNDExXkEyXkFqcGdeQXVyNjUwNzk3NDc@._V1_UX67_CR0,0,67,98_AL_.jpg",Guess Who's Coming to Dinner,1967,,108 min,"Comedy, Drama",7.8,A couple's attitudes are challenged when their daughter introduces them to her African-American fiancé.,63.0,Stanley Kramer,Spencer Tracy,Sidney Poitier,Katharine Hepburn,Katharine Houghton,39642,56700000,Tomie dePaola,7.14,295.0
703,"https://m.media-amazon.com/images/M/MV5BNGM0ZTU3NmItZmRmMy00YWNjLWEzMWItYzg3MzcwZmM5NjdiXkEyXkFqcGdeQXVyNDYyMDk5MTU@._V1_UY98_CR2,0,67,98_AL_.jpg",My Fair Lady,1964,U,170 min,"Drama, Family, Musical",7.8,Snobbish phonetics Professor Henry Higgins agrees to a wager that he can make flower girl Eliza Doolittle presentable in high society.,95.0,George Cukor,Audrey Hepburn,Rex Harrison,Stanley Holloway,Wilfrid Hyde-White,86525,72000000,George Bernard Shaw,8.52,15618.0
704,"https://m.media-amazon.com/images/M/MV5BNmJkODczNjItNDI5Yy00MGI1LTkyOWItZDNmNjM4ZGI1ZDVlL2ltYWdlL2ltYWdlXkEyXkFqcGdeQXVyMDI2NDg0NQ@@._V1_UX67_CR0,0,67,98_AL_.jpg",Mary Poppins,1964,U,139 min,"Comedy, Family, Fantasy",7.8,"In turn of the century London, a magical nanny employs music and adventure to help two neglected children become closer to their father.",88.0,Robert Stevenson,Julie Andrews,Dick Van Dyke,David Tomlinson,Glynis Johns,158029,102272727,P.L. Travers,8.04,127561.0
705,"https://m.media-amazon.com/images/M/MV5BZTM1ZjQ2YTktNDM2MS00NGY2LTkzNzItZTU4ODg1ODNkMWYxL2ltYWdlXkEyXkFqcGdeQXVyNjc1NTYyMjg@._V1_UX67_CR0,0,67,98_AL_.jpg",The Longest Day,1962,G,178 min,"Action, Drama, History",7.8,"The events of D-Day, told on a grand scale from both the Allied and German points of view.",75.0,Ken Annakin,Andrew Marton,Gerd Oswald,Bernhard Wicki,Darryl F. Zanuck,52141,39100000,Cornelius Ryan,8.64,23107.0
706,"https://m.media-amazon.com/images/M/MV5BZTM1MTRiNDctMTFiMC00NGM1LTkyMWQtNTY1M2JjZDczOWQ3XkEyXkFqcGdeQXVyMDI3OTIzOA@@._V1_UY98_CR3,0,67,98_AL_.jpg",Jules et Jim,1962,,105 min,"Drama, Romance",7.8,Decades of a love triangle concerning two friends and an impulsive woman.,97.0,François Truffaut,Jeanne Moreau,Oskar Werner,Henri Serre,Vanna Urbino,37605,,Henri-Pierre Roché,7.24,1756.0
707,"https://m.media-amazon.com/images/M/MV5BNGQyNjBjNTUtNTM1OS00YzcyLWFhNTgtNTU0MDg3NzBlMDQzXkEyXkFqcGdeQXVyNjc1NTYyMjg@._V1_UY98_CR0,0,67,98_AL_.jpg",The Innocents,1961,A,100 min,Horror,7.8,A young governess for two children becomes convinced that the house and grounds are haunted.,88.0,Jack Clayton,Deborah Kerr,Peter Wyngarde,Megs Jenkins,Michael Redgrave,27007,2616000,David Baldacci,8.32,98954.0
709,"https://m.media-amazon.com/images/M/MV5BNzNiOGJhMDUtZjNjMC00YmE5LTk3NjQtNGM4ZjAzOGJjZmRlXkEyXkFqcGdeQXVyNjc1NTYyMjg@._V1_UX67_CR0,0,67,98_AL_.jpg",Red River,1948,Passed,133 min,"Action, Adventure, Drama",7.8,"Dunson leads a cattle drive, the culmination of over 14 years of work, to its destination in Missouri. But his tyrannical behavior along the way causes a mutiny, led by his adopted son.",,Howard Hawks,Arthur Rosson,John Wayne,Montgomery Clift,Joanne Dru,28167,,Chie Shinohara,8.46,10771.0
710,"https://m.media-amazon.com/images/M/MV5BODI3YzNiZTUtYjEyZS00ODkwLWE2ZDUtNGJmMTNiYTc4ZTM4XkEyXkFqcGdeQXVyMDI2NDg0NQ@@._V1_UX67_CR0,0,67,98_AL_.jpg",Key Largo,1948,,100 min,"Action, Crime, Drama",7.8,"A man visits his war buddy's family hotel and finds a gangster running things. As a hurricane approaches, the two end up confronting each other.",,John Huston,Humphrey Bogart,Edward G. Robinson,Lauren Bacall,Lionel Barrymore,36995,,Nicholas Harvey,8.66,203.0
711,"https://m.media-amazon.com/images/M/MV5BZGU2YmU0MWMtMzg5My00ZmY2LTljMDItMTg2YTI5Y2U2OTE3XkEyXkFqcGdeQXVyMjUxODE0MDY@._V1_UY98_CR0,0,67,98_AL_.jpg",To Have and Have Not,1944,PG,100 min,"Adventure, Comedy, Film-Noir",7.8,"During World War II, American expatriate Harry Morgan helps transport a French Resistance leader and his beautiful wife to Martinique while romancing a sensuous lounge singer.",,Howard Hawks,Humphrey Bogart,Lauren Bacall,Walter Brennan,Dolores Moran,31053,,Ernest Hemingway,7.06,29883.0
712,"https://m.media-amazon.com/images/M/MV5BM2I1YWM4NTYtYjA0Ny00ZDEwLTg3NTgtNzBjMzZhZTk1YTA1XkEyXkFqcGdeQXVyMTY5Nzc4MDY@._V1_UX67_CR0,0,67,98_AL_.jpg",Shadow of a Doubt,1943,PG,108 min,"Film-Noir, Thriller",7.8,"A young girl, overjoyed when her favorite uncle comes to visit the family, slowly begins to suspect that he is in fact the ""Merry Widow"" killer sought by the authorities.",94.0,Alfred Hitchcock,Teresa Wright,Joseph Cotten,Macdonald Carey,Henry Travers,59556,,Tiffany Snow,8.34,2259.0
713,"https://m.media-amazon.com/images/M/MV5BOGQ4NDUyNWQtZTEyOC00OTMzLWFhYjAtNDNmYmQ2MWQyMTRmXkEyXkFqcGdeQXVyNTA4NzY1MzY@._V1_UX67_CR0,0,67,98_AL_.jpg",Stagecoach,1939,Passed,96 min,"Adventure, Drama, Western",7.8,A group of people traveling on a stagecoach find their journey complicated by the threat of Geronimo and learn something about each other in the process.,93.0,John Ford,John Wayne,Claire Trevor,Andy Devine,John Carradine,43621,,Carolyn Keene,7.86,5901.0
714,"https://m.media-amazon.com/images/M/MV5BNjk3YzFjYTktOGY0ZS00Y2EwLTk2NTctYTI1Nzc2OWNiN2I4XkEyXkFqcGdeQXVyNzM0MTUwNTY@._V1_UX67_CR0,0,67,98_AL_.jpg",The Lady Vanishes,1938,,96 min,"Mystery, Thriller",7.8,"While travelling in continental Europe, a rich young playgirl realizes that an elderly lady seems to have disappeared from the train.",98.0,Alfred Hitchcock,Margaret Lockwood,Michael Redgrave,Paul Lukas,May Whitty,47400,,Amanda Quick,7.86,6247.0
715,"https://m.media-amazon.com/images/M/MV5BMmVkOTRiYmItZjE4NS00MWNjLWE0ZmMtYzg5YzFjMjMyY2RkXkEyXkFqcGdeQXVyNjc1NTYyMjg@._V1_UX67_CR0,0,67,98_AL_.jpg",Bringing Up Baby,1938,Passed,102 min,"Comedy, Family, Romance",7.8,"While trying to secure a $1 million donation for his museum, a befuddled paleontologist is pursued by a flighty and often irritating heiress and her pet leopard, Baby.",91.0,Howard Hawks,Katharine Hepburn,Cary Grant,Charles Ruggles,Walter Catlett,55163,,Shyla Colt,8.46,162.0
716,"https://m.media-amazon.com/images/M/MV5BOTUzMzAzMzEzNV5BMl5BanBnXkFtZTgwOTg1NTAwMjE@._V1_UX67_CR0,0,67,98_AL_.jpg",Bride of Frankenstein,1935,,75 min,"Drama, Horror, Sci-Fi",7.8,"Mary Shelley reveals the main characters of her novel survived: Dr. Frankenstein, goaded by an even madder scientist, builds his monster a mate.",95.0,James Whale,Boris Karloff,Elsa Lanchester,Colin Clive,Valerie Hobson,43542,4360000,Debbie Dadey,7.6,584.0
717,"https://m.media-amazon.com/images/M/MV5BYmYxZGU2NWYtNzQxZS00NmEyLWIzN2YtMDk5MWM0ODc5ZTE4XkEyXkFqcGdeQXVyNTA4NzY1MzY@._V1_UX67_CR0,0,67,98_AL_.jpg",Duck Soup,1933,,69 min,"Comedy, Musical, War",7.8,Rufus T. Firefly is named president/dictator of bankrupt Freedonia and declares war on neighboring Sylvania over the love of wealthy Mrs. Teasdale.,93.0,Leo McCarey,Groucho Marx,Harpo Marx,Chico Marx,Zeppo Marx,55581,,Jackie Urbanovic,7.76,1074.0
718,"https://m.media-amazon.com/images/M/MV5BYmMxZTU2ZDUtM2Y1MS00ZWFmLWJlN2UtNzI0OTJiOTYzMTk3XkEyXkFqcGdeQXVyMjUxODE0MDY@._V1_UX67_CR0,0,67,98_AL_.jpg",Scarface: The Shame of the Nation,1932,PG,93 min,"Action, Crime, Drama",7.8,"An ambitious and nearly insane violent gangster climbs the ladder of success in the mob, but his weaknesses prove to be his downfall.",87.0,Howard Hawks,Richard Rosson,Paul Muni,Ann Dvorak,Karen Morley,25312,,Nadine Klemens,0.0,0.0
719,"https://m.media-amazon.com/images/M/MV5BMTQ0Njc1MjM0OF5BMl5BanBnXkFtZTgwNTY2NTUyMjE@._V1_UX67_CR0,0,67,98_AL_.jpg",Frankenstein,1931,Passed,70 min,"Drama, Horror, Sci-Fi",7.8,Dr. Frankenstein dares to tamper with life and death by creating a human monster out of lifeless body parts.,91.0,James Whale,Colin Clive,Mae Clarke,Boris Karloff,John Boles,65341,,Mary Wollstonecraft Shelley,7.7,1430247.0
722,"https://m.media-amazon.com/images/M/MV5BNjk1Njk3YjctMmMyYS00Y2I4LThhMzktN2U0MTMyZTFlYWQ5XkEyXkFqcGdeQXVyODM2ODEzMDA@._V1_UY98_CR15,0,67,98_AL_.jpg",Deadpool 2,2018,R,119 min,"Action, Adventure, Comedy",7.7,"Foul-mouthed mutant mercenary Wade Wilson (a.k.a. Deadpool), brings together a team of fellow mutant rogues to protect a young boy with supernatural abilities from the brutal, time-traveling cyborg Cable.",66.0,David Leitch,Ryan Reynolds,Josh Brolin,Morena Baccarin,Julian Dennison,478586,324591735,Cullen Bunn,8.08,3798.0
725,"https://m.media-amazon.com/images/M/MV5BNjRlZmM0ODktY2RjNS00ZDdjLWJhZGYtNDljNWZkMGM5MTg0XkEyXkFqcGdeQXVyNjAwMjI5MDk@._V1_UX67_CR0,0,67,98_AL_.jpg",Mission: Impossible - Fallout,2018,UA,147 min,"Action, Adventure, Thriller",7.7,"Ethan Hunt and his IMF team, along with some familiar allies, race against time after a mission gone wrong.",86.0,Christopher McQuarrie,Tom Cruise,Henry Cavill,Ving Rhames,Simon Pegg,291257,220159104,Joy Vallo,9.0,2.0
726,"https://m.media-amazon.com/images/M/MV5BMjE0NDUyOTc2MV5BMl5BanBnXkFtZTgwODk2NzU3OTE@._V1_UX67_CR0,0,67,98_AL_.jpg",En man som heter Ove,2015,PG-13,116 min,"Comedy, Drama, Romance",7.7,"Ove, an ill-tempered, isolated retiree who spends his days enforcing block association rules and visiting his wife's grave, has finally given up on life just as an unlikely friendship develops with his boisterous new neighbors.",70.0,Hannes Holm,Rolf Lassgård,Bahar Pars,Filip Berg,Ida Engvoll,47444,3358518,Fredrik Backman,8.74,837542.0
729,"https://m.media-amazon.com/images/M/MV5BMTAwMTU4MDA3NDNeQTJeQWpwZ15BbWU4MDk4NTMxNTIx._V1_UX67_CR0,0,67,98_AL_.jpg",The Theory of Everything,2014,U,123 min,"Biography, Drama, Romance",7.7,A look at the relationship between the famous physicist Stephen Hawking and his wife.,72.0,James Marsh,Eddie Redmayne,Felicity Jones,Tom Prior,Sophie Perry,404182,35893537,Stephen Hawking,8.36,22040.0
730,"https://m.media-amazon.com/images/M/MV5BYTM3ZTllNzItNTNmOS00NzJiLTg1MWMtMjMxNDc0NmJhODU5XkEyXkFqcGdeQXVyODE5NzE3OTE@._V1_UX67_CR0,0,67,98_AL_.jpg",Kingsman: The Secret Service,2014,A,129 min,"Action, Adventure, Comedy",7.7,"A spy organisation recruits a promising street kid into the agency's training program, while a global threat emerges from a twisted tech genius.",60.0,Matthew Vaughn,Colin Firth,Taron Egerton,Samuel L. Jackson,Michael Caine,590440,128261724,Mark Millar,7.18,3990.0
731,"https://m.media-amazon.com/images/M/MV5BNTVkMTFiZWItOTFkOC00YTc3LWFhYzQtZTg3NzAxZjJlNTAyXkEyXkFqcGdeQXVyODE5NzE3OTE@._V1_UX67_CR0,0,67,98_AL_.jpg",The Fault in Our Stars,2014,UA,126 min,"Drama, Romance",7.7,Two teenage cancer patients begin a life-affirming journey to visit a reclusive author in Amsterdam.,69.0,Josh Boone,Shailene Woodley,Ansel Elgort,Nat Wolff,Laura Dern,344312,124872350,John Green,8.3,4644323.0
732,"https://m.media-amazon.com/images/M/MV5BNTA1NzUzNjY4MV5BMl5BanBnXkFtZTgwNDU0MDI0NTE@._V1_UX67_CR0,0,67,98_AL_.jpg",Me and Earl and the Dying Girl,2015,PG-13,105 min,"Comedy, Drama",7.7,"High schooler Greg, who spends most of his time making parodies of classic movies with his co-worker Earl, finds his outlook forever altered after befriending a classmate who has just been diagnosed with cancer.",74.0,Alfonso Gomez-Rejon,Thomas Mann,RJ Cyler,Olivia Cooke,Nick Offerman,123210,6743776,Jesse Andrews,7.06,135441.0
736,"https://m.media-amazon.com/images/M/MV5BMTQzMzg2Nzg2MF5BMl5BanBnXkFtZTgwNjUzNzIzMDE@._V1_UX67_CR0,0,67,98_AL_.jpg",The Broken Circle Breakdown,2012,,111 min,"Drama, Music, Romance",7.7,"Elise and Didier fall in love at first sight, in spite of their differences. He talks, she listens. He's a romantic atheist, she's a religious realist. When their daughter becomes seriously ill, their love is put on trial.",70.0,Felix van Groeningen,Veerle Baetens,Johan Heldenbergh,Nell Cattrysse,Geert Van Rampelberg,39379,175058,Mieke Dobbels,7.0,6.0
737,"https://m.media-amazon.com/images/M/MV5BMzA2NDkwODAwM15BMl5BanBnXkFtZTgwODk5MTgzMTE@._V1_UY98_CR0,0,67,98_AL_.jpg",Captain America: The Winter Soldier,2014,UA,136 min,"Action, Adventure, Sci-Fi",7.7,"As Steve Rogers struggles to embrace his role in the modern world, he teams up with a fellow Avenger and S.H.I.E.L.D agent, Black Widow, to battle a new threat from history: an assassin known as the Winter Soldier.",70.0,Anthony Russo,Joe Russo,Chris Evans,Samuel L. Jackson,Scarlett Johansson,736182,259766572,Ed Brubaker,8.26,182.0
738,"https://m.media-amazon.com/images/M/MV5BOTc3NzAxMjg4M15BMl5BanBnXkFtZTcwMDc2ODQwNw@@._V1_UY98_CR3,0,67,98_AL_.jpg",Rockstar,2011,UA,159 min,"Drama, Music, Musical",7.7,"Janardhan Jakhar chases his dreams of becoming a big Rock star, during which he falls in love with Heer.",,Imtiaz Ali,Ranbir Kapoor,Nargis Fakhri,Shammi Kapoor,Kumud Mishra,39501,985912,Bec Botefuhr,7.72,5791.0
740,"https://m.media-amazon.com/images/M/MV5BNzMxNTExOTkyMF5BMl5BanBnXkFtZTcwMzEyNDc0OA@@._V1_UX67_CR0,0,67,98_AL_.jpg",Wreck-It Ralph,2012,U,101 min,"Animation, Adventure, Comedy",7.7,"A video game villain wants to be a hero and sets out to fulfill his dream, but his quest brings havoc to the whole arcade where he lives.",72.0,Rich Moore,John C. Reilly,Jack McBrayer,Jane Lynch,Sarah Silverman,380195,189422889,Jennifer Lee,8.8,1293.0
741,"https://m.media-amazon.com/images/M/MV5BNjg0OTM5OTQyNV5BMl5BanBnXkFtZTgwNDg5NDQ0NTE@._V1_UY98_CR2,0,67,98_AL_.jpg",Le Petit Prince,2015,PG,108 min,"Animation, Adventure, Drama",7.7,"A little girl lives in a very grown-up world with her mother, who tries to prepare her for it. Her neighbor, the Aviator, introduces the girl to an extraordinary world where anything is possible, the world of the Little Prince.",70.0,Mark Osborne,Jeff Bridges,Mackenzie Foy,Rachel McAdams,Marion Cotillard,56720,1339152,Antoine de Saint-Exupéry,8.64,1861854.0
742,"https://m.media-amazon.com/images/M/MV5BMTM3NzQzMDA5Ml5BMl5BanBnXkFtZTcwODA5NTcyNw@@._V1_UY98_CR0,0,67,98_AL_.jpg",Detachment,2011,,98 min,Drama,7.7,A substitute teacher who drifts from classroom to classroom finds a connection to the students and teachers during his latest assignment.,52.0,Tony Kaye,Adrien Brody,Christina Hendricks,Marcia Gay Harden,Lucy Liu,77071,71177,Barry Eisler,8.32,8242.0
743,"https://m.media-amazon.com/images/M/MV5BMTM4NjY1MDQwMl5BMl5BanBnXkFtZTcwNTI3Njg3NA@@._V1_UX67_CR0,0,67,98_AL_.jpg",Midnight in Paris,2011,PG-13,96 min,"Comedy, Fantasy, Romance",7.7,"While on a trip to Paris with his fiancée's family, a nostalgic screenwriter finds himself mysteriously going back to the 1920s every day at midnight.",81.0,Woody Allen,Owen Wilson,Rachel McAdams,Kathy Bates,Kurt Fuller,388089,56816662,Woody Allen,8.58,273.0
744,"https://m.media-amazon.com/images/M/MV5BMTg4MDk1ODExN15BMl5BanBnXkFtZTgwNzIyNjg3MDE@._V1_UX67_CR0,0,67,98_AL_.jpg",The Lego Movie,2014,U,100 min,"Animation, Action, Adventure",7.7,"An ordinary LEGO construction worker, thought to be the prophesied as ""special"", is recruited to join a quest to stop an evil tyrant from gluing the LEGO universe into eternal stasis.",83.0,Christopher Miller,Phil Lord,Chris Pratt,Will Ferrell,Elizabeth Banks,323982,257760692,Kate Howard,8.4,892.0
745,"https://m.media-amazon.com/images/M/MV5BNjE5MzYwMzYxMF5BMl5BanBnXkFtZTcwOTk4MTk0OQ@@._V1_UX67_CR0,0,67,98_AL_.jpg",Gravity,2013,UA,91 min,"Drama, Sci-Fi, Thriller",7.7,Two astronauts work together to survive after an accident leaves them stranded in space.,96.0,Alfonso Cuarón,Sandra Bullock,George Clooney,Ed Harris,Orto Ignatiussen,769145,274092705,Thomas Pynchon,8.0,41276.0
746,"https://m.media-amazon.com/images/M/MV5BMTk2NzczOTgxNF5BMl5BanBnXkFtZTcwODQ5ODczOQ@@._V1_UX67_CR0,0,67,98_AL_.jpg",Star Trek Into Darkness,2013,UA,132 min,"Action, Adventure, Sci-Fi",7.7,"After the crew of the Enterprise find an unstoppable force of terror from within their own organization, Captain Kirk leads a manhunt to a war-zone world to capture a one-man weapon of mass destruction.",72.0,J.J. Abrams,Chris Pine,Zachary Quinto,Zoe Saldana,Benedict Cumberbatch,463188,228778661,Alan Dean Foster,7.72,1332.0
747,"https://m.media-amazon.com/images/M/MV5BMTYwMzMzMDI0NF5BMl5BanBnXkFtZTgwNDQ3NjI3NjE@._V1_UX67_CR0,0,67,98_AL_.jpg",Beasts of No Nation,2015,,137 min,"Drama, War",7.7,"A drama based on the experiences of Agu, a child soldier fighting in the civil war of an unnamed African country.",79.0,Cary Joji Fukunaga,Abraham Attah,Emmanuel Affadzi,Ricky Adelayitor,Andrew Adote,73964,83861,Uzodinma Iweala,7.54,5925.0
748,"https://m.media-amazon.com/images/M/MV5BOGUyZDUxZjEtMmIzMC00MzlmLTg4MGItZWJmMzBhZjE0Mjc1XkEyXkFqcGdeQXVyMTMxODk2OTU@._V1_UX67_CR0,0,67,98_AL_.jpg",The Social Network,2010,UA,120 min,"Biography, Drama",7.7,"As Harvard student Mark Zuckerberg creates the social networking site that would become known as Facebook, he is sued by the twins who claimed he stole their idea, and by the co-founder who was later squeezed out of the business.",95.0,David Fincher,Jesse Eisenberg,Andrew Garfield,Justin Timberlake,Rooney Mara,624982,96962694,Danah Boyd,7.58,2203.0
749,"https://m.media-amazon.com/images/M/MV5BMTg5OTMxNzk4Nl5BMl5BanBnXkFtZTcwOTk1MjAwNQ@@._V1_UX67_CR0,0,67,98_AL_.jpg",X: First Class,2011,UA,131 min,"Action, Adventure, Sci-Fi",7.7,"In the 1960s, superpowered humans Charles Xavier and Erik Lensherr work together to find others like them, but Erik's vengeful pursuit of an ambitious mutant who ruined his life causes a schism to divide them.",65.0,Matthew Vaughn,James McAvoy,Michael Fassbender,Jennifer Lawrence,Kevin Bacon,645512,146408305,Jeff Parker,7.48,1358.0
750,"https://m.media-amazon.com/images/M/MV5BNGQwZjg5YmYtY2VkNC00NzliLTljYTctNzI5NmU3MjE2ODQzXkEyXkFqcGdeQXVyNzkwMjQ5NzM@._V1_UX67_CR0,0,67,98_AL_.jpg",The Hangover,2009,UA,100 min,Comedy,7.7,"Three buddies wake up from a bachelor party in Las Vegas, with no memory of the previous night and the bachelor missing. They make their way around the city in order to find their friend before his wedding.",73.0,Todd Phillips,Zach Galifianakis,Bradley Cooper,Justin Bartha,Ed Helms,717559,277322503,R.S. Lively,7.78,789.0
