,Poster_Link,Series_Title,Released_Year,Certificate,Runtime,Genre,IMDB_Rating,Overview,Meta_score,Director,Star1,Star2,Star3,Star4,No_of_Votes,Gross,Autor_libro,Nota_promedio_libro,Votos_libro
0,"https://m.media-amazon.com/images/M/MV5BMDFkYTc0MGEtZmNhMC00ZDIzLWFmNTEtODM1ZmRlYWMwMWFmXkEyXkFqcGdeQXVyMTMxODk2OTU@._V1_UX67_CR0,0,67,98_AL_.jpg",The Shawshank Redemption,1994,A,142 min,Drama,9.3,"Two imprisoned men bond over a number of years, finding solace and eventual redemption through acts of common decency.",80.0,Frank Darabont,Tim Robbins,Morgan Freeman,Bob Gunton,William Sadler,2343110,28341469,Stephen King,8.96,2430.0
1,"https://m.media-amazon.com/images/M/MV5BM2MyNjYxNmUtYTAwNi00MTYxLWJmNWYtYzZlODY3ZTk3OTFlXkEyXkFqcGdeQXVyNzkwMjQ5NzM@._V1_UY98_CR1,0,67,98_AL_.jpg",The Godfather,1972,A,175 min,"Crime, Drama",9.2,An organized crime dynasty's aging patriarch transfers control of his clandestine empire to his reluctant son.,100.0,Francis Ford Coppola,Marlon Brando,Al Pacino,James Caan,Diane Keaton,1620367,134966411,Mario Puzo,8.76,390111.0
2,"https://m.media-amazon.com/images/M/MV5BMTMxNTMwODM0NF5BMl5BanBnXkFtZTcwODAyMTk2Mw@@._V1_UX67_CR0,0,67,98_AL_.jpg",The Dark Knight,2008,UA,152 min,"Action, Crime, Drama",9.0,"When the menace known as the Joker wreaks havoc and chaos on the people of Gotham, Batman must accept one of the greatest psychological and physical tests of his ability to fight injustice.",84.0,Christopher Nolan,Christian Bale,Heath Ledger,Aaron Eckhart,Michael Caine,2303232,534858444,Frank Miller,8.52,179633.0
3,"https://m.media-amazon.com/images/M/MV5BMWMwMGQzZTItY2JlNC00OWZiLWIyMDctNDk2ZDQ2YjRjMWQ0XkEyXkFqcGdeQXVyNzkwMjQ5NzM@._V1_UY98_CR1,0,67,98_AL_.jpg",The Godfather: Part II,1974,A,202 min,"Crime, Drama",9.0,"The early life and career of Vito Corleone in 1920s New York City is portrayed, while his son, Michael, expands and tightens his grip on the family crime syndicate.",90.0,Francis Ford Coppola,Al Pacino,Robert De Niro,Robert Duvall,Diane Keaton,1129952,57300000,Elizabeth Tubbs,10.0,1.0
4,"https://m.media-amazon.com/images/M/MV5BMWU4N2FjNzYtNTVkNC00NzQ0LTg0MjAtYTJlMjFhNGUxZDFmXkEyXkFqcGdeQXVyNjc1NTYyMjg@._V1_UX67_CR0,0,67,98_AL_.jpg",12 Angry Men,1957,U,96 min,"Crime, Drama",9.0,A jury holdout attempts to prevent a miscarriage of justice by forcing his colleagues to reconsider the evidence.,96.0,Sidney Lumet,Henry Fonda,Lee J. Cobb,Martin Balsam,John Fiedler,689845,4360000,Reginald Rose,8.14,29209.0
5,"https://m.media-amazon.com/images/M/MV5BNzA5ZDNlZWMtM2NhNS00NDJjLTk4NDItYTRmY2EwMWZlMTY3XkEyXkFqcGdeQXVyNzkwMjQ5NzM@._V1_UX67_CR0,0,67,98_AL_.jpg",The Lord of the Rings: The Return of the King,2003,U,201 min,"Action, Adventure, Drama",8.9,Gandalf and Aragorn lead the World of Men against Sauron's army to draw his gaze from Frodo and Sam as they approach Mount Doom with the One Ring.,94.0,Peter Jackson,Elijah Wood,Viggo Mortensen,Ian McKellen,Orlando Bloom,1642758,377845905,Jude Fisher,9.24,22171.0
7,"https://m.media-amazon.com/images/M/MV5BNDE4OTMxMTctNmRhYy00NWE2LTg3YzItYTk3M2UwOTU5Njg4XkEyXkFqcGdeQXVyNjU0OTQ0OTY@._V1_UX67_CR0,0,67,98_AL_.jpg",Schindler's List,1993,A,195 min,"Biography, Drama, History",8.9,"In German-occupied Poland during World War II, industrialist Oskar Schindler gradually becomes concerned for his Jewish workforce after witnessing their persecution by the Nazis.",94.0,Steven Spielberg,Liam Neeson,Ralph Fiennes,Ben Kingsley,Caroline Goodall,1213505,96898818,Thomas Keneally,8.68,155888.0
8,"https://m.media-amazon.com/images/M/MV5BMjAxMzY3NjcxNF5BMl5BanBnXkFtZTcwNTI5OTM0Mw@@._V1_UX67_CR0,0,67,98_AL_.jpg",Inception,2010,UA,148 min,"Action, Adventure, Sci-Fi",8.8,A thief who steals corporate secrets through the use of dream-sharing technology is given the inverse task of planting an idea into the mind of a C.E.O.,74.0,Christopher Nolan,Leonardo DiCaprio,Joseph Gordon-Levitt,Elliot Page,Ken Watanabe,2067042,292576195,Bianca Scardoni,7.96,11740.0
9,"https://m.media-amazon.com/images/M/MV5BMmEzNTkxYjQtZTc0MC00YTVjLTg5ZTEtZWMwOWVlYzY0NWIwXkEyXkFqcGdeQXVyNzkwMjQ5NzM@._V1_UX67_CR0,0,67,98_AL_.jpg",Fight Club,1999,A,139 min,Drama,8.8,"An insomniac office worker and a devil-may-care soapmaker form an underground fight club that evolves into something much, much more.",66.0,David Fincher,Brad Pitt,Edward Norton,Meat Loaf,Zach Grenier,1854740,37030102,Chuck Palahniuk,8.38,553401.0
10,"https://m.media-amazon.com/images/M/MV5BN2EyZjM3NzUtNWUzMi00MTgxLWI0NTctMzY4M2VlOTdjZWRiXkEyXkFqcGdeQXVyNDUzOTQ5MjY@._V1_UX67_CR0,0,67,98_AL_.jpg",The Lord of the Rings: The Fellowship of the Ring,2001,U,178 min,"Action, Adventure, Drama",8.8,A meek Hobbit from the Shire and eight companions set out on a journey to destroy the powerful One Ring and save Middle-earth from the Dark Lord Sauron.,92.0,Peter Jackson,Elijah Wood,Ian McKellen,Orlando Bloom,Sean Bean,1661481,315544750,Jude Fisher,9.3,31104.0
11,"https://m.media-amazon.com/images/M/MV5BNWIwODRlZTUtY2U3ZS00Yzg1LWJhNzYtMmZiYmEyNmU1NjMzXkEyXkFqcGdeQXVyMTQxNzMzNDI@._V1_UY98_CR0,0,67,98_AL_.jpg",Forrest Gump,1994,UA,142 min,"Drama, Romance",8.8,"The presidencies of Kennedy and Johnson, the events of Vietnam, Watergate and other historical events unfold through the perspective of an Alabama man with an IQ of 75, whose only desire is to be reunited with his childhood sweetheart.",82.0,Robert Zemeckis,Tom Hanks,Robin Wright,Gary Sinise,Sally Field,1809221,330252182,Winston Groom,8.08,65412.0
12,"https://m.media-amazon.com/images/M/MV5BOTQ5NDI3MTI4MF5BMl5BanBnXkFtZTgwNDQ4ODE5MDE@._V1_UX67_CR0,0,67,98_AL_.jpg","Il buono, il brutto, il cattivo",1966,A,161 min,Western,8.8,A bounty hunting scam joins two men in an uneasy alliance against a third in a race to find a fortune in gold buried in a remote cemetery.,90.0,Sergio Leone,Clint Eastwood,Eli Wallach,Lee Van Cleef,Aldo Giuffrè,688390,6100000,Sergio Della Sala,6.0,4.0
13,"https://m.media-amazon.com/images/M/MV5BZGMxZTdjZmYtMmE2Ni00ZTdkLWI5NTgtNjlmMjBiNzU2MmI5XkEyXkFqcGdeQXVyNjU0OTQ0OTY@._V1_UX67_CR0,0,67,98_AL_.jpg",The Lord of the Rings: The Two Towers,2002,UA,179 min,"Action, Adventure, Drama",8.7,"While Frodo and Sam edge closer to Mordor with the help of the shifty Gollum, the divided fellowship makes a stand against Sauron's new ally, Saruman, and his hordes of Isengard.",87.0,Peter Jackson,Elijah Wood,Ian McKellen,Viggo Mortensen,Orlando Bloom,1485555,342551365,Brian Sibley,9.34,60232.0
15,"https://m.media-amazon.com/images/M/MV5BY2NkZjEzMDgtN2RjYy00YzM1LWI4ZmQtMjIwYjFjNmI3ZGEwXkEyXkFqcGdeQXVyNzkwMjQ5NzM@._V1_UX67_CR0,0,67,98_AL_.jpg",Goodfellas,1990,A,146 min,"Biography, Crime, Drama",8.7,"The story of Henry Hill and his life in the mob, covering his relationship with his wife Karen Hill and his mob partners Jimmy Conway and Tommy DeVito in the Italian-American crime syndicate.",90.0,Martin Scorsese,Robert De Niro,Ray Liotta,Joe Pesci,Lorraine Bracco,1020727,46836394,Glenn Kenny,7.44,749.0
16,"https://m.media-amazon.com/images/M/MV5BYmU1NDRjNDgtMzhiMi00NjZmLTg5NGItZDNiZjU5NTU4OTE0XkEyXkFqcGdeQXVyNzkwMjQ5NzM@._V1_UX67_CR0,0,67,98_AL_.jpg",Star Wars: Episode V - The Empire Strikes Back,1980,UA,124 min,"Action, Adventure, Fantasy",8.7,"After the Rebels are brutally overpowered by the Empire on the ice planet Hoth, Luke Skywalker begins Jedi training with Yoda, while his friends are pursued by Darth Vader and a bounty hunter named Boba Fett all over the galaxy.",82.0,Irvin Kershner,Mark Hamill,Harrison Ford,Carrie Fisher,Billy Dee Williams,1159315,290475067,Deborah Call,8.76,893.0
17,"https://m.media-amazon.com/images/M/MV5BZjA0OWVhOTAtYWQxNi00YzNhLWI4ZjYtNjFjZTEyYjJlNDVlL2ltYWdlL2ltYWdlXkEyXkFqcGdeQXVyMTQxNzMzNDI@._V1_UX67_CR0,0,67,98_AL_.jpg",One Flew Over the Cuckoo's Nest,1975,A,133 min,Drama,8.7,"A criminal pleads insanity and is admitted to a mental institution, where he rebels against the oppressive nurse and rallies up the scared patients.",83.0,Milos Forman,Jack Nicholson,Louise Fletcher,Michael Berryman,Peter Brocco,918088,112000000,Ken Kesey,8.4,696612.0
18,"https://m.media-amazon.com/images/M/MV5BNjViNWRjYWEtZTI0NC00N2E3LTk0NGQtMjY4NTM3OGNkZjY0XkEyXkFqcGdeQXVyMjUxMTY3ODM@._V1_UX67_CR0,0,67,98_AL_.jpg",Hamilton,2020,PG-13,160 min,"Biography, Drama, History",8.6,"The real life of one of America's foremost founding fathers and first Secretary of the Treasury, Alexander Hamilton. Captured live on Broadway from the Richard Rodgers Theater with the original Broadway cast.",90.0,Thomas Kail,Lin-Manuel Miranda,Phillipa Soo,Leslie Odom Jr.,Renée Elise Goldsberry,55291,,Ron Chernow,8.42,167093.0
22,"https://m.media-amazon.com/images/M/MV5BOTMwYjc5ZmItYTFjZC00ZGQ3LTlkNTMtMjZiNTZlMWQzNzI5XkEyXkFqcGdeQXVyNzkwMjQ5NzM@._V1_UX67_CR0,0,67,98_AL_.jpg",Cidade de Deus,2002,A,130 min,"Crime, Drama",8.6,"In the slums of Rio, two kids' paths diverge as one struggles to become a photographer and the other a kingpin.",79.0,Fernando Meirelles,Kátia Lund,Alexandre Rodrigues,Leandro Firmino,Matheus Nachtergaele,699256,7563397,Paulo Lins,7.86,1896.0
23,"https://m.media-amazon.com/images/M/MV5BMjlmZmI5MDctNDE2YS00YWE0LWE5ZWItZDBhYWQ0NTcxNWRhXkEyXkFqcGdeQXVyMTMxODk2OTU@._V1_UX67_CR0,0,67,98_AL_.jpg",Sen to Chihiro no kamikakushi,2001,U,125 min,"Animation, Adventure, Family",8.6,"During her family's move to the suburbs, a sullen 10-year-old girl wanders into a world ruled by gods, witches, and spirits, and where humans are changed into beasts.",96.0,Hayao Miyazaki,Daveigh Chase,Suzanne Pleshette,Miyu Irino,Rumi Hiiragi,651376,10055859,Hayao Miyazaki,8.92,24.0
24,"https://m.media-amazon.com/images/M/MV5BZjhkMDM4MWItZTVjOC00ZDRhLThmYTAtM2I5NzBmNmNlMzI1XkEyXkFqcGdeQXVyNDYyMDk5MTU@._V1_UX67_CR0,0,67,98_AL_.jpg",Saving Private Ryan,1998,R,169 min,"Drama, War",8.6,"Following the Normandy Landings, a group of U.S. soldiers go behind enemy lines to retrieve a paratrooper whose brothers have been killed in action.",91.0,Steven Spielberg,Tom Hanks,Matt Damon,Tom Sizemore,Edward Burns,1235804,216540909,Jacqueline Kehl,8.58,1181.0
25,"https://m.media-amazon.com/images/M/MV5BMTUxMzQyNjA5MF5BMl5BanBnXkFtZTYwOTU2NTY3._V1_UX67_CR0,0,67,98_AL_.jpg",The Green Mile,1999,A,189 min,"Crime, Drama, Fantasy",8.6,"The lives of guards on Death Row are affected by one of their charges: a black man accused of child murder and rape, yet who has a mysterious gift.",61.0,Frank Darabont,Tom Hanks,Michael Clarke Duncan,David Morse,Bonnie Hunt,1147794,136801374,Stephen King,8.94,291760.0
26,"https://m.media-amazon.com/images/M/MV5BYmJmM2Q4NmMtYThmNC00ZjRlLWEyZmItZTIwOTBlZDQ3NTQ1XkEyXkFqcGdeQXVyMTQxNzMzNDI@._V1_UX67_CR0,0,67,98_AL_.jpg",La vita è bella,1997,U,116 min,"Comedy, Drama, Romance",8.6,"When an open-minded Jewish librarian and his son become victims of the Holocaust, he uses a perfect mixture of will, humor, and imagination to protect his son from the dangers around their camp.",59.0,Roberto Benigni,Roberto Benigni,Nicoletta Braschi,Giorgio Cantarini,Giustino Durano,623629,57598247,Roberto Benigni,8.86,113.0
28,"https://m.media-amazon.com/images/M/MV5BNjNhZTk0ZmEtNjJhMi00YzFlLWE1MmEtYzM1M2ZmMGMwMTU4XkEyXkFqcGdeQXVyNjU0OTQ0OTY@._V1_UX67_CR0,0,67,98_AL_.jpg",The Silence of the Lambs,1991,A,118 min,"Crime, Drama, Thriller",8.6,"A young F.B.I. cadet must receive the help of an incarcerated and manipulative cannibal killer to help catch another serial killer, a madman who skins his victims.",85.0,Jonathan Demme,Jodie Foster,Anthony Hopkins,Lawrence A. Bonney,Kasi Lemmons,1270197,130742922,Thomas Harris,8.46,522232.0
30,"https://m.media-amazon.com/images/M/MV5BYjBmYTQ1NjItZWU5MS00YjI0LTg2OTYtYmFkN2JkMmNiNWVkXkEyXkFqcGdeQXVyMTMxMTY0OTQ@._V1_UY98_CR2,0,67,98_AL_.jpg",Seppuku,1962,,133 min,"Action, Drama, Mystery",8.6,"When a ronin requesting seppuku at a feudal lord's palace is told of the brutal suicide of another ronin who previously visited, he reveals how their pasts are intertwined - and in doing so challenges the clan's integrity.",85.0,Masaki Kobayashi,Tatsuya Nakadai,Akira Ishihama,Shima Iwashita,Tetsurô Tanba,42004,,Peter Watts,7.56,1775.0
32,"https://m.media-amazon.com/images/M/MV5BZjc4NDZhZWMtNGEzYS00ZWU2LThlM2ItNTA0YzQ0OTExMTE2XkEyXkFqcGdeQXVyNjUwMzI2NzU@._V1_UY98_CR0,0,67,98_AL_.jpg",It's a Wonderful Life,1946,PG,130 min,"Drama, Family, Fantasy",8.6,An angel is sent from Heaven to help a desperately frustrated businessman by showing him what life would have been like if he had never existed.,89.0,Frank Capra,James Stewart,Donna Reed,Lionel Barrymore,Thomas Mitchell,405801,,Bob Welch,8.64,399.0
33,"https://m.media-amazon.com/images/M/MV5BNGVjNWI4ZGUtNzE0MS00YTJmLWE0ZDctN2ZiYTk2YmI3NTYyXkEyXkFqcGdeQXVyMTkxNjUyNQ@@._V1_UX67_CR0,0,67,98_AL_.jpg",Joker,2019,A,122 min,"Crime, Drama, Thriller",8.5,"In Gotham City, mentally troubled comedian Arthur Fleck is disregarded and mistreated by society. He then embarks on a downward spiral of revolution and bloody crime. This path brings him face-to-face with his alter-ego: the Joker.",59.0,Todd Phillips,Joaquin Phoenix,Robert De Niro,Zazie Beetz,Frances Conroy,939252,335451311,Brian Azzarello,8.06,33431.0
34,"https://m.media-amazon.com/images/M/MV5BOTA5NDZlZGUtMjAxOS00YTRkLTkwYmMtYWQ0NWEwZDZiNjEzXkEyXkFqcGdeQXVyMTMxODk2OTU@._V1_UX67_CR0,0,67,98_AL_.jpg",Whiplash,2014,A,106 min,"Drama, Music",8.5,A promising young drummer enrolls at a cut-throat music conservatory where his dreams of greatness are mentored by an instructor who will stop at nothing to realize a student's potential.,88.0,Damien Chazelle,Miles Teller,J.K. Simmons,Melissa Benoist,Paul Reiser,717585,13092000,Catherine Coulter,8.34,12705.0
36,"https://m.media-amazon.com/images/M/MV5BMjA4NDI0MTIxNF5BMl5BanBnXkFtZTYwNTM0MzY2._V1_UX67_CR0,0,67,98_AL_.jpg",The Prestige,2006,U,130 min,"Drama, Mystery, Sci-Fi",8.5,"After a tragic accident, two stage magicians engage in a battle to create the ultimate illusion while sacrificing everything they have to outwit each other.",66.0,Christopher Nolan,Christian Bale,Hugh Jackman,Scarlett Johansson,Michael Caine,1190259,53089891,Christopher Priest,7.82,20386.0
37,"https://m.media-amazon.com/images/M/MV5BMTI1MTY2OTIxNV5BMl5BanBnXkFtZTYwNjQ4NjY3._V1_UX67_CR0,0,67,98_AL_.jpg",The Departed,2006,A,151 min,"Crime, Drama, Thriller",8.5,An undercover cop and a mole in the police attempt to identify each other while infiltrating an Irish gang in South Boston.,85.0,Martin Scorsese,Leonardo DiCaprio,Matt Damon,Jack Nicholson,Mark Wahlberg,1189773,132384315,J.A. Templeton,8.44,2413.0
39,"https://m.media-amazon.com/images/M/MV5BMDliMmNhNDEtODUyOS00MjNlLTgxODEtN2U3NzIxMGVkZTA1L2ltYWdlXkEyXkFqcGdeQXVyNjU0OTQ0OTY@._V1_UX67_CR0,0,67,98_AL_.jpg",Gladiator,2000,UA,155 min,"Action, Adventure, Drama",8.5,A former Roman General sets out to exact vengeance against the corrupt emperor who murdered his family and sent him into slavery.,67.0,Ridley Scott,Russell Crowe,Joaquin Phoenix,Connie Nielsen,Oliver Reed,1341460,187705427,Ruby Dixon,8.3,6857.0
41,"https://m.media-amazon.com/images/M/MV5BYTViNjMyNmUtNDFkNC00ZDRlLThmMDUtZDU2YWE4NGI2ZjVmXkEyXkFqcGdeQXVyNjU0OTQ0OTY@._V1_UX67_CR0,0,67,98_AL_.jpg",The Usual Suspects,1995,A,106 min,"Crime, Mystery, Thriller",8.5,"A sole survivor tells of the twisty events leading up to a horrific gun battle on a boat, which began when five criminals met at a seemingly random police lineup.",77.0,Bryan Singer,Kevin Spacey,Gabriel Byrne,Chazz Palminteri,Stephen Baldwin,991208,23341568,Maurice Broaddus,7.34,496.0
43,"https://m.media-amazon.com/images/M/MV5BYTYxNGMyZTYtMjE3MS00MzNjLWFjNmYtMDk3N2FmM2JiM2M1XkEyXkFqcGdeQXVyNjY5NDU4NzI@._V1_UX67_CR0,0,67,98_AL_.jpg",The Lion King,1994,U,88 min,"Animation, Adventure, Drama",8.5,"Lion prince Simba and his father are targeted by his bitter uncle, who wants to ascend the throne himself.",88.0,Roger Allers,Rob Minkoff,Matthew Broderick,Jeremy Irons,James Earl Jones,942045,422783777,Justine Korman Fontes,8.96,27416.0
44,"https://m.media-amazon.com/images/M/MV5BMGU2NzRmZjUtOGUxYS00ZjdjLWEwZWItY2NlM2JhNjkxNTFmXkEyXkFqcGdeQXVyNjU0OTQ0OTY@._V1_UX67_CR0,0,67,98_AL_.jpg",Terminator 2: Judgment Day,1991,U,137 min,"Action, Sci-Fi",8.5,"A cyborg, identical to the one who failed to kill Sarah Connor, must now protect her teenage son, John Connor, from a more advanced and powerful cyborg.",75.0,James Cameron,Arnold Schwarzenegger,Linda Hamilton,Edward Furlong,Robert Patrick,995506,204843350,Randall Frakes,8.1,1367.0
45,"https://m.media-amazon.com/images/M/MV5BM2FhYjEyYmYtMDI1Yy00YTdlLWI2NWQtYmEzNzAxOGY1NjY2XkEyXkFqcGdeQXVyNTA3NTIyNDg@._V1_UX67_CR0,0,67,98_AL_.jpg",Nuovo Cinema Paradiso,1988,U,155 min,"Drama, Romance",8.5,A filmmaker recalls his childhood when falling in love with the pictures at the cinema of his home village and forms a deep friendship with the cinema's projectionist.,80.0,Giuseppe Tornatore,Philippe Noiret,Enzo Cannavale,Antonella Attili,Isa Danieli,230763,11990401,Franco Cristaldi,8.4,5.0
46,"https://m.media-amazon.com/images/M/MV5BZmY2NjUzNDQtNTgxNC00M2Q4LTljOWQtMjNjNDBjNWUxNmJlXkEyXkFqcGdeQXVyNTA4NzY1MzY@._V1_UX67_CR0,0,67,98_AL_.jpg",Hotaru no haka,1988,U,89 min,"Animation, Drama, War",8.5,A young boy and his little sister struggle to survive in Japan during World War II.,94.0,Isao Takahata,Tsutomu Tatsumi,Ayano Shiraishi,Akemi Yamaguchi,Yoshiko Shinohara,235231,,Akiyuki Nosaka,8.12,1889.0
47,"https://m.media-amazon.com/images/M/MV5BZmU0M2Y1OGUtZjIxNi00ZjBkLTg1MjgtOWIyNThiZWIwYjRiXkEyXkFqcGdeQXVyMTQxNzMzNDI@._V1_UX67_CR0,0,67,98_AL_.jpg",Back to the Future,1985,U,116 min,"Adventure, Comedy, Sci-Fi",8.5,"Marty McFly, a 17-year-old high school student, is accidentally sent thirty years into the past in a time-traveling DeLorean invented by his close friend, the eccentric scientist Doc Brown.",87.0,Robert Zemeckis,Michael J. Fox,Christopher Lloyd,Lea Thompson,Crispin Glover,1058081,210609762,George Gipe,8.42,2742.0
49,"https://m.media-amazon.com/images/M/MV5BNTQwNDM1YzItNDAxZC00NWY2LTk0M2UtNDIwNWI5OGUyNWUxXkEyXkFqcGdeQXVyNzkwMjQ5NzM@._V1_UX67_CR0,0,67,98_AL_.jpg",Psycho,1960,A,109 min,"Horror, Mystery, Thriller",8.5,"A Phoenix secretary embezzles $40,000 from her employer's client, goes on the run, and checks into a remote motel run by a young man under the domination of his mother.",97.0,Alfred Hitchcock,Anthony Perkins,Janet Leigh,Vera Miles,John Gavin,604211,32000000,Bret Easton Ellis,7.64,280015.0
50,"https://m.media-amazon.com/images/M/MV5BY2IzZGY2YmEtYzljNS00NTM5LTgwMzUtMzM1NjQ4NGI0OTk0XkEyXkFqcGdeQXVyNDYyMDk5MTU@._V1_UX67_CR0,0,67,98_AL_.jpg",Casablanca,1942,U,102 min,"Drama, Romance, War",8.5,A cynical expatriate American cafe owner struggles to decide whether or not to help his former lover and her fugitive husband escape the Nazis in French Morocco.,100.0,Michael Curtiz,Humphrey Bogart,Ingrid Bergman,Paul Henreid,Claude Rains,522093,1024560,Fiona Valpy,8.88,26744.0
53,"https://m.media-amazon.com/images/M/MV5BMmExNzU2ZWMtYzUwYi00YmM2LTkxZTQtNmVhNjY0NTMyMWI2XkEyXkFqcGdeQXVyMTMxODk2OTU@._V1_UX67_CR0,0,67,98_AL_.jpg",Capharnaüm,2018,A,126 min,Drama,8.4,"While serving a five-year sentence for a violent crime, a 12-year-old boy sues his parents for neglect.",75.0,Nadine Labaki,Zain Al Rafeea,Yordanos Shiferaw,Boluwatife Treasure Bankole,Kawsar Al Haddad,62635,1661096,Lewis Trondheim,7.26,52.0
58,"https://m.media-amazon.com/images/M/MV5BMjMwNDkxMTgzOF5BMl5BanBnXkFtZTgwNTkwNTQ3NjM@._V1_UX67_CR0,0,67,98_AL_.jpg",Spider-Man: Into the Spider-Verse,2018,U,117 min,"Animation, Action, Adventure",8.4,"Teen Miles Morales becomes the Spider-Man of his universe, and must join with five spider-powered individuals from other dimensions to stop a threat for all realities.",87.0,Bob Persichetti,Peter Ramsey,Rodney Rothman,Shameik Moore,Jake Johnson,375110,190241310,Ramin Zahed,9.4,880.0
62,"https://m.media-amazon.com/images/M/MV5BMjIyNTQ5NjQ1OV5BMl5BanBnXkFtZTcwODg1MDU4OA@@._V1_UX67_CR0,0,67,98_AL_.jpg",Django Unchained,2012,A,165 min,"Drama, Western",8.4,"With the help of a German bounty hunter, a freed slave sets out to rescue his wife from a brutal Mississippi plantation owner.",81.0,Quentin Tarantino,Jamie Foxx,Christoph Waltz,Leonardo DiCaprio,Kerry Washington,1357682,162805434,Quentin Tarantino,8.36,993.0
63,"https://m.media-amazon.com/images/M/MV5BMTk4ODQzNDY3Ml5BMl5BanBnXkFtZTcwODA0NTM4Nw@@._V1_UX67_CR0,0,67,98_AL_.jpg",The Dark Knight Rises,2012,UA,164 min,"Action, Adventure",8.4,"Eight years after the Joker's reign of anarchy, Batman, with the help of the enigmatic Catwoman, is forced from his exile to save Gotham City from the brutal guerrilla terrorist Bane.",78.0,Christopher Nolan,Christian Bale,Tom Hardy,Anne Hathaway,Gary Oldman,1516346,448139099,Greg Cox,8.3,1340.0
65,"https://m.media-amazon.com/images/M/MV5BMDhjZWViN2MtNzgxOS00NmI4LThiZDQtZDI3MzM4MDE4NTc0XkEyXkFqcGdeQXVyMTMxODk2OTU@._V1_UY98_CR1,0,67,98_AL_.jpg",Taare Zameen Par,2007,U,165 min,"Drama, Family",8.4,"An eight-year-old boy is thought to be a lazy trouble-maker, until the new art teacher has the patience and compassion to discover the real problem behind his struggles in school.",,Aamir Khan,Amole Gupte,Darsheel Safary,Aamir Khan,Tisca Chopra,168895,1223869,Amole Gupte,8.26,8.0
70,"https://m.media-amazon.com/images/M/MV5BNGIzY2IzODQtNThmMi00ZDE4LWI5YzAtNzNlZTM1ZjYyYjUyXkEyXkFqcGdeQXVyODEzNjM5OTQ@._V1_UX67_CR0,0,67,98_AL_.jpg",Mononoke-hime,1997,U,134 min,"Animation, Action, Adventure",8.4,"On a journey to find the cure for a Tatarigami's curse, Ashitaka finds himself in the middle of a war between the forest gods and Tatara, a mining colony. In this quest he also meets San, the Mononoke Hime.",76.0,Hayao Miyazaki,Yôji Matsuda,Yuriko Ishida,Yûko Tanaka,Billy Crudup,343171,2375308,Hayao Miyazaki,8.54,322.0
71,"https://m.media-amazon.com/images/M/MV5BMGFkNWI4MTMtNGQ0OC00MWVmLTk3MTktOGYxN2Y2YWVkZWE2XkEyXkFqcGdeQXVyNjU0OTQ0OTY@._V1_UX67_CR0,0,67,98_AL_.jpg",Once Upon a Time in America,1984,A,229 min,"Crime, Drama",8.4,"A former Prohibition-era Jewish gangster returns to the Lower East Side of Manhattan over thirty years later, where he once again must confront the ghosts and regrets of his old life.",,Sergio Leone,Robert De Niro,James Woods,Elizabeth McGovern,Treat Williams,311365,5321508,Adrian Martin,7.62,70.0
72,"https://m.media-amazon.com/images/M/MV5BMjA0ODEzMTc1Nl5BMl5BanBnXkFtZTcwODM2MjAxNA@@._V1_UX67_CR0,0,67,98_AL_.jpg",Raiders of the Lost Ark,1981,A,115 min,"Action, Adventure",8.4,"In 1936, archaeologist and adventurer Indiana Jones is hired by the U.S. government to find the Ark of the Covenant before Adolf Hitler's Nazis can obtain its awesome powers.",85.0,Steven Spielberg,Harrison Ford,Karen Allen,Paul Freeman,John Rhys-Davies,884112,248159971,Campbell Black,8.4,4140.0
73,"https://m.media-amazon.com/images/M/MV5BZWFlYmY2MGEtZjVkYS00YzU4LTg0YjQtYzY1ZGE3NTA5NGQxXkEyXkFqcGdeQXVyMTQxNzMzNDI@._V1_UX67_CR0,0,67,98_AL_.jpg",The Shining,1980,A,146 min,"Drama, Horror",8.4,"A family heads to an isolated hotel for the winter where a sinister presence influences the father into violence, while his psychic son sees horrific forebodings from both past and future.",66.0,Stanley Kubrick,Jack Nicholson,Shelley Duvall,Danny Lloyd,Scatman Crothers,898237,44017374,Stephen King,8.52,1357524.0
74,"https://m.media-amazon.com/images/M/MV5BMDdhODg0MjYtYzBiOS00ZmI5LWEwZGYtZDEyNDU4MmQyNzFkXkEyXkFqcGdeQXVyNzkwMjQ5NzM@._V1_UX67_CR0,0,67,98_AL_.jpg",Apocalypse Now,1979,R,147 min,"Drama, Mystery, War",8.4,A U.S. Army officer serving in Vietnam is tasked with assassinating a renegade Special Forces Colonel who sees himself as a god.,94.0,Francis Ford Coppola,Martin Sheen,Marlon Brando,Robert Duvall,Frederic Forrest,606398,83471511,Charlie Human,7.46,1286.0
75,"https://m.media-amazon.com/images/M/MV5BMmQ2MmU3NzktZjAxOC00ZDZhLTk4YzEtMDMyMzcxY2IwMDAyXkEyXkFqcGdeQXVyNzkwMjQ5NzM@._V1_UX67_CR0,0,67,98_AL_.jpg",Alien,1979,R,117 min,"Horror, Sci-Fi",8.4,"After a space merchant vessel receives an unknown transmission as a distress call, one of the crew is attacked by a mysterious life form and they soon realize that its life cycle has merely begun.",89.0,Ridley Scott,Sigourney Weaver,Tom Skerritt,John Hurt,Veronica Cartwright,787806,78900000,Ruby Dixon,7.6,48397.0
77,"https://m.media-amazon.com/images/M/MV5BOTI4NTNhZDMtMWNkZi00MTRmLWJmZDQtMmJkMGVmZTEzODlhXkEyXkFqcGdeQXVyNjc1NTYyMjg@._V1_UX67_CR0,0,67,98_AL_.jpg",Tengoku to jigoku,1963,,143 min,"Crime, Drama, Mystery",8.4,An executive of a shoe company becomes a victim of extortion when his chauffeur's son is kidnapped and held for ransom.,,Akira Kurosawa,Toshirô Mifune,Yutaka Sada,Tatsuya Nakadai,Kyôko Kagawa,34357,,Jirō Akagawa,6.0,1.0
78,"https://m.media-amazon.com/images/M/MV5BZWI3ZTMxNjctMjdlNS00NmUwLWFiM2YtZDUyY2I3N2MxYTE0XkEyXkFqcGdeQXVyNzkwMjQ5NzM@._V1_UX67_CR0,0,67,98_AL_.jpg",Dr. Strangelove or: How I Learned to Stop Worrying and Love the Bomb,1964,A,95 min,Comedy,8.4,An insane general triggers a path to nuclear holocaust that a War Room full of politicians and generals frantically tries to stop.,97.0,Stanley Kubrick,Peter Sellers,George C. Scott,Sterling Hayden,Keenan Wynn,450474,275902,Peter George,7.64,1186.0
79,"https://m.media-amazon.com/images/M/MV5BNDQwODU5OWYtNDcyNi00MDQ1LThiOGMtZDkwNWJiM2Y3MDg0XkEyXkFqcGdeQXVyMDI2NDg0NQ@@._V1_UX67_CR0,0,67,98_AL_.jpg",Witness for the Prosecution,1957,U,116 min,"Crime, Drama, Mystery",8.4,A veteran British barrister must defend his client in a murder trial that has surprise after surprise.,,Billy Wilder,Tyrone Power,Marlene Dietrich,Charles Laughton,Elsa Lanchester,108862,8175000,Agatha Christie,8.12,4302.0
80,"https://m.media-amazon.com/images/M/MV5BNjViMmRkOTEtM2ViOS00ODg0LWJhYWEtNTBlOGQxNDczOGY3XkEyXkFqcGdeQXVyMDI2NDg0NQ@@._V1_UY98_CR2,0,67,98_AL_.jpg",Paths of Glory,1957,A,88 min,"Drama, War",8.4,"After refusing to attack an enemy position, a general accuses the soldiers of cowardice and their commanding officer must defend them.",90.0,Stanley Kubrick,Kirk Douglas,Ralph Meeker,Adolphe Menjou,George Macready,178092,,Jeffrey Archer,7.98,18492.0
