,Poster_Link,Series_Title,Released_Year,Certificate,Runtime,Genre,IMDB_Rating,Overview,Meta_score,Director,Star1,Star2,Star3,Star4,No_of_Votes,Gross,Autor_libro,Nota_promedio_libro,Votos_libro
511,"https://m.media-amazon.com/images/M/MV5BM2JkNGU0ZGMtZjVjNS00NjgyLWEyOWYtZmRmZGQyN2IxZjA2XkEyXkFqcGdeQXVyNTIzOTk5ODM@._V1_UX67_CR0,0,67,98_AL_.jpg",The Bourne Identity,2002,UA,119 min,"Action, Mystery, Thriller",7.9,"A man is picked up by a fishing boat, bullet-riddled and suffering from amnesia, before racing to elude assassins and attempting to regain his memory.",68.0,Doug Liman,Franka Potente,Matt Damon,Chris Cooper,Clive Owen,508771,121661683,Robert Ludlum,8.08,423305.0
513,"https://m.media-amazon.com/images/M/MV5BMTQ5NTI2NTI4NF5BMl5BanBnXkFtZTcwNjk2NDA2OQ@@._V1_UX67_CR0,0,67,98_AL_.jpg",Children of Men,2006,A,109 min,"Adventure, Drama, Sci-Fi",7.9,"In 2027, in a chaotic world in which women have become somehow infertile, a former activist agrees to help transport a miraculously pregnant woman to a sanctuary at sea.",84.0,Alfonso Cuarón,Julianne Moore,Clive Owen,Chiwetel Ejiofor,Michael Caine,465113,35552383,P.D. James,7.36,44874.0
514,"https://m.media-amazon.com/images/M/MV5BMzY1ZjMwMGEtYTY1ZS00ZDllLTk0ZmUtYzA3ZTA4NmYwNGNkXkEyXkFqcGdeQXVyNDk3NzU2MTQ@._V1_UX67_CR0,0,67,98_AL_.jpg",Almost Famous,2000,A,122 min,"Adventure, Comedy, Drama",7.9,A high-school boy is given the chance to write a story for Rolling Stone Magazine about an up-and-coming rock band as he accompanies them on their concert tour.,90.0,Cameron Crowe,Billy Crudup,Patrick Fugit,Kate Hudson,Frances McDormand,252586,32534850,Megan Mayhew Bergman,6.94,3166.0
516,"https://m.media-amazon.com/images/M/MV5BMWM5ZDcxMTYtNTEyNS00MDRkLWI3YTItNThmMGExMWY4NDIwXkEyXkFqcGdeQXVyNjUwNzk3NDc@._V1_UX67_CR0,0,67,98_AL_.jpg",Toy Story 2,1999,U,92 min,"Animation, Adventure, Comedy",7.9,"When Woody is stolen by a toy collector, Buzz and his friends set out on a rescue mission to save Woody before he becomes a museum toy property with his roundup gang Jessie, Prospector, and Bullseye.",88.0,John Lasseter,Ash Brannon,Lee Unkrich,Tom Hanks,Tim Allen,527512,245852179,Kathleen Weidner Zoehfeld,8.86,2109.0
517,"https://m.media-amazon.com/images/M/MV5BY2E2YWYxY2QtZmJmZi00MjJlLWFiYWItZTk5Y2IyMWQ1ZThhXkEyXkFqcGdeQXVyMTMxODk2OTU@._V1_UX67_CR0,0,67,98_AL_.jpg",Boogie Nights,1997,R,155 min,Drama,7.9,"Back when sex was safe, pleasure was a business and business was booming, an idealistic porn producer aspires to elevate his craft to an art when he discovers a hot young talent.",85.0,Paul Thomas Anderson,Mark Wahlberg,Julianne Moore,Burt Reynolds,Luis Guzmán,239473,26400640,Paul Thomas Anderson,8.76,108.0
519,"https://m.media-amazon.com/images/M/MV5BYTY4MTdjZDMtOTBiMC00MDEwLThhMjUtMjlhMjdlYTBmMzk3XkEyXkFqcGdeQXVyNjMwMjk0MTQ@._V1_UY98_CR1,0,67,98_AL_.jpg",Once Were Warriors,1994,A,102 min,"Crime, Drama",7.9,A family descended from Maori warriors is bedeviled by a violent father and the societal problems of being treated as outcasts.,77.0,Lee Tamahori,Rena Owen,Temuera Morrison,Mamaengaroa Kerr-Bell,Julian Arahanga,31590,2201126,Alan Duff,7.92,3141.0
521,"https://m.media-amazon.com/images/M/MV5BMjg5OGU4OGYtNTZmNy00MjQ1LWIzYzgtMTllMGY2NzlkNzYwXkEyXkFqcGdeQXVyMTI3ODAyMzE2._V1_UY98_CR2,0,67,98_AL_.jpg",Trois couleurs: Bleu,1993,U,94 min,"Drama, Music, Mystery",7.9,A woman struggles to find a way to live her life after the death of her husband and child.,85.0,Krzysztof Kieslowski,Juliette Binoche,Zbigniew Zamachowski,Julie Delpy,Benoît Régent,89836,1324974,Krzysztof Kieślowski,8.44,27.0
523,"https://m.media-amazon.com/images/M/MV5BN2I2N2Q1YmMtMzZkMC00Y2JjLWJmOWUtNjc2OTM2ZTk1MjUyXkEyXkFqcGdeQXVyNzkwMjQ5NzM@._V1_UX67_CR0,0,67,98_AL_.jpg",Carlito's Way,1993,A,144 min,"Crime, Drama, Thriller",7.9,"A Puerto Rican former convict, just released from prison, pledges to stay away from drugs and violence despite the pressure around him and lead on to a better life outside of N.Y.C.",65.0,Brian De Palma,Al Pacino,Sean Penn,Penelope Ann Miller,John Leguizamo,201000,36948322,Edwin Torres,8.0,280.0
524,"https://m.media-amazon.com/images/M/MV5BNDUxN2I5NDUtZjdlMC00NjlmLTg0OTQtNjk0NjAxZjFmZTUzXkEyXkFqcGdeQXVyMTQxNzMzNDI@._V1_UX67_CR0,0,67,98_AL_.jpg",Edward Scissorhands,1990,U,105 min,"Drama, Fantasy, Romance",7.9,"An artificial man, who was incompletely constructed and has scissors for hands, leads a solitary life. Then one day, a suburban lady meets him and introduces him to her world.",74.0,Tim Burton,Johnny Depp,Winona Ryder,Dianne Wiest,Anthony Michael Hall,447368,56362352,Kate Leth,7.14,854.0
526,"https://m.media-amazon.com/images/M/MV5BYWY3N2EyOWYtNDVhZi00MWRkLTg2OTUtODNkNDQ5ZTIwMGJkXkEyXkFqcGdeQXVyMTMxODk2OTU@._V1_UX67_CR0,0,67,98_AL_.jpg",Crimes and Misdemeanors,1989,PG-13,104 min,"Comedy, Drama",7.9,An ophthalmologist's mistress threatens to reveal their affair to his wife while a married documentary filmmaker is infatuated with another woman.,77.0,Woody Allen,Martin Landau,Woody Allen,Bill Bernstein,Claire Bloom,54670,18254702,Jeffrey Toobin,8.36,1055.0
527,"https://m.media-amazon.com/images/M/MV5BYTVjYWJmMWQtYWU4Ni00MWY3LWI2YmMtNTI5MDE0MWVmMmEzL2ltYWdlXkEyXkFqcGdeQXVyMTQxNzMzNDI@._V1_UX67_CR0,0,67,98_AL_.jpg",The Untouchables,1987,A,119 min,"Crime, Drama, Thriller",7.9,"During the era of Prohibition in the United States, Federal Agent Eliot Ness sets out to stop ruthless Chicago gangster Al Capone and, because of rampant corruption, assembles a small, hand-picked team to help him.",79.0,Brian De Palma,Kevin Costner,Sean Connery,Robert De Niro,Charles Martin Smith,281842,76270454,J.J. McAvoy,8.82,12956.0
528,"https://m.media-amazon.com/images/M/MV5BMWZiNWUwYjMtM2Y1Yi00MTZmLWEwYzctNjVmYWM0OTFlZDFhXkEyXkFqcGdeQXVyMTMxODk2OTU@._V1_UX67_CR0,0,67,98_AL_.jpg",Hannah and Her Sisters,1986,PG-13,107 min,"Comedy, Drama",7.9,"Between two Thanksgivings two years apart, Hannah's husband falls in love with her sister Lee, while her hypochondriac ex-husband rekindles his relationship with her sister Holly.",90.0,Woody Allen,Mia Farrow,Dianne Wiest,Michael Caine,Barbara Hershey,67176,40084041,Woody Allen,8.26,310.0
529,"https://m.media-amazon.com/images/M/MV5BMzIwM2IwYTItYmM4Zi00OWMzLTkwNjAtYWRmYWNmY2RhMDk0XkEyXkFqcGdeQXVyNjU0OTQ0OTY@._V1_UX67_CR0,0,67,98_AL_.jpg",Brazil,1985,U,132 min,"Drama, Sci-Fi",7.9,A bureaucrat in a dystopic society becomes an enemy of the state as he pursues the woman of his dreams.,84.0,Terry Gilliam,Jonathan Pryce,Kim Greist,Robert De Niro,Katherine Helmond,187567,9929135,Ira Levin,8.12,37060.0
530,"https://m.media-amazon.com/images/M/MV5BMTQ2MTIzMzg5Nl5BMl5BanBnXkFtZTgwOTc5NDI1MDE@._V1_UX67_CR0,0,67,98_AL_.jpg",This Is Spinal Tap,1984,R,82 min,"Comedy, Music",7.9,"Spinal Tap, one of England's loudest bands, is chronicled by film director Marty DiBergi on what proves to be a fateful tour.",92.0,Rob Reiner,Rob Reiner,Michael McKean,Christopher Guest,Kimberly Stringer,128812,188751,Karl French,8.5,84.0
531,"https://m.media-amazon.com/images/M/MV5BOWMyNjE0MzEtMzVjNy00NjIxLTg0ZjMtMWJhNGI1YmVjYTczL2ltYWdlXkEyXkFqcGdeQXVyNzc5MjA3OA@@._V1_UX67_CR0,0,67,98_AL_.jpg",A Christmas Story,1983,U,93 min,"Comedy, Family",7.9,"In the 1940s, a young boy named Ralphie attempts to convince his parents, his teacher and Santa that a Red Ryder BB gun really is the perfect Christmas gift.",77.0,Bob Clark,Peter Billingsley,Melinda Dillon,Darren McGavin,Scott Schwartz,132947,20605209,Maxine Rose Schur,8.16,6837.0
532,"https://m.media-amazon.com/images/M/MV5BYTdlMDExOGUtN2I3MS00MjY5LWE1NTAtYzc3MzIxN2M3OWY1XkEyXkFqcGdeQXVyNzkwMjQ5NzM@._V1_UX67_CR0,0,67,98_AL_.jpg",The Blues Brothers,1980,U,133 min,"Action, Adventure, Comedy",7.9,"Jake Blues, just released from prison, puts together his old band to save the Catholic home where he and his brother Elwood were raised.",60.0,John Landis,John Belushi,Dan Aykroyd,Cab Calloway,John Candy,183182,57229890,The Blues Brothers,0.0,0.0
533,"https://m.media-amazon.com/images/M/MV5BMzdmY2I3MmEtOGFiZi00MTg1LWIxY2QtNWUwM2NmNWNlY2U5XkEyXkFqcGdeQXVyNDk3NzU2MTQ@._V1_UX67_CR0,0,67,98_AL_.jpg",Manhattan,1979,R,96 min,"Comedy, Drama, Romance",7.9,The life of a divorced television writer dating a teenage girl is further complicated when he falls in love with his best friend's mistress.,83.0,Woody Allen,Woody Allen,Diane Keaton,Mariel Hemingway,Michael Murphy,131436,45700000,Sophie Kinsella,7.54,120093.0
534,"https://m.media-amazon.com/images/M/MV5BZWE4N2JkNDUtZDU4MC00ZjNhLTlkMjYtOTNkMjZhMDAwMDMyXkEyXkFqcGdeQXVyMTA0MjU0Ng@@._V1_UX67_CR0,0,67,98_AL_.jpg",All That Jazz,1979,A,123 min,"Drama, Music, Musical",7.9,"Director/choreographer Bob Fosse tells his own life story as he details the sordid career of Joe Gideon, a womanizing, drug-using dancer.",72.0,Bob Fosse,Roy Scheider,Jessica Lange,Ann Reinking,Leland Palmer,28223,37823676,Natasha Boyd,8.02,2274.0
535,"https://m.media-amazon.com/images/M/MV5BMzc1YTIyNjctYzhlNy00ZmYzLWI2ZWQtMzk4MmQwYzA0NGQ1XkEyXkFqcGdeQXVyMTQxNzMzNDI@._V1_UX67_CR0,0,67,98_AL_.jpg",Dawn of the Dead,1978,A,127 min,"Action, Adventure, Horror",7.9,"Following an ever-growing epidemic of zombies that have risen from the dead, two Philadelphia S.W.A.T. team members, a traffic reporter, and his television executive girlfriend seek refuge in a secluded shopping mall.",71.0,George A. Romero,David Emge,Ken Foree,Scott H. Reiniger,Gaylen Ross,111512,5100000,George A. Romero,7.66,1709.0
536,"https://m.media-amazon.com/images/M/MV5BOWI2YWQxM2MtY2U4Yi00YjgzLTgwNzktN2ExNTgzNTIzMmUzXkEyXkFqcGdeQXVyMTAwMzUyOTc@._V1_UX67_CR0,0,67,98_AL_.jpg",All the President's Men,1976,U,138 min,"Biography, Drama, History",7.9,"""The Washington Post"" reporters Bob Woodward and Carl Bernstein uncover the details of the Watergate scandal that leads to President Richard Nixon's resignation.",84.0,Alan J. Pakula,Dustin Hoffman,Robert Redford,Jack Warden,Martin Balsam,103031,70600000,Carl Bernstein,8.34,52429.0
537,"https://m.media-amazon.com/images/M/MV5BN2IzM2I5NTQtMTIyMy00YWM2LWI1OGMtNjI0MWIyNDZkZGFkXkEyXkFqcGdeQXVyMTQxNzMzNDI@._V1_UX67_CR0,0,67,98_AL_.jpg",La montaña sagrada,1973,R,114 min,"Adventure, Drama, Fantasy",7.9,"In a corrupt, greed-fueled world, a powerful alchemist leads a messianic character and seven materialistic figures to the Holy Mountain, where they hope to achieve enlightenment.",76.0,Alejandro Jodorowsky,Alejandro Jodorowsky,Horacio Salinas,Zamira Saunders,Juan Ferrara,37183,61001,Claudio Naranjo,9.0,34.0
540,"https://m.media-amazon.com/images/M/MV5BMjRkY2VhYzMtZWQyNS00OTY2LWE5NTAtYjlhNmQyYzE5MmUxXkEyXkFqcGdeQXVyMTQxNzMzNDI@._V1_UX67_CR0,0,67,98_AL_.jpg","Aguirre, der Zorn Gottes",1972,,95 min,"Action, Adventure, Biography",7.9,"In the 16th century, the ruthless and insane Don Lope de Aguirre leads a Spanish expedition in search of El Dorado.",,Werner Herzog,Klaus Kinski,Ruy Guerra,Helena Rojo,Del Negro,52397,,Frederic Schafer,0.0,0.0
541,"https://m.media-amazon.com/images/M/MV5BY2M5Mzg3NjctZTlkNy00MTU0LWFlYTQtY2E2Y2M4NjNiNzllXkEyXkFqcGdeQXVyMTAwMzUyOTc@._V1_UX67_CR0,0,67,98_AL_.jpg",Harold and Maude,1971,PG,91 min,"Comedy, Drama, Romance",7.9,"Young, rich, and obsessed with death, Harold finds himself changed forever when he meets lively septuagenarian Maude at a funeral.",62.0,Hal Ashby,Ruth Gordon,Bud Cort,Vivian Pickles,Cyril Cusack,70826,,Colin Higgins,8.14,2237.0
544,"https://m.media-amazon.com/images/M/MV5BMzRmN2E1ZDUtZDc2ZC00ZmI3LTkwOTctNzE2ZDIzMGJiMTYzXkEyXkFqcGdeQXVyMTQxNzMzNDI@._V1_UX67_CR0,0,67,98_AL_.jpg",Night of the Living Dead,1968,,96 min,"Horror, Thriller",7.9,A ragtag group of Pennsylvanians barricade themselves in an old farmhouse to remain safe from a horde of flesh-eating ghouls that are ravaging the East Coast of the United States.,89.0,George A. Romero,Duane Jones,Judith O'Dea,Karl Hardman,Marilyn Eastman,116557,89029,Night of the Living Dead,0.0,0.0
545,"https://m.media-amazon.com/images/M/MV5BMTkzNzYyMzA5N15BMl5BanBnXkFtZTgwODcwODQ3MDI@._V1_UX67_CR0,0,67,98_AL_.jpg",The Lion in Winter,1968,PG,134 min,"Biography, Drama, History",7.9,"1183 A.D.: King Henry II's three sons all want to inherit the throne, but he won't commit to a choice. They and his wife variously plot to force him.",,Anthony Harvey,Peter O'Toole,Katharine Hepburn,Anthony Hopkins,John Castle,29003,22276975,James Goldman,8.44,9674.0
546,"https://m.media-amazon.com/images/M/MV5BZjZhZTZkNWItZGE1My00MTRkLWI2ZDktMWZkZTIxZWYxOTgzXkEyXkFqcGdeQXVyNDY2MTk1ODk@._V1_UX67_CR0,0,67,98_AL_.jpg",In the Heat of the Night,1967,U,110 min,"Crime, Drama, Mystery",7.9,A black police detective is asked to investigate a murder in a racially hostile southern town.,75.0,Norman Jewison,Sidney Poitier,Rod Steiger,Warren Oates,Lee Grant,67804,24379978,John Dudley Ball,7.78,2593.0
547,"https://m.media-amazon.com/images/M/MV5BMTA0Y2UyMDUtZGZiOS00ZmVkLTg3NmItODQyNTY1ZjU1MWE4L2ltYWdlL2ltYWdlXkEyXkFqcGdeQXVyNjc1NTYyMjg@._V1_UX67_CR0,0,67,98_AL_.jpg",Charade,1963,U,113 min,"Comedy, Mystery, Romance",7.9,Romance and suspense ensue in Paris as a woman is pursued by several men who want a fortune her murdered husband had stolen. Whom can she trust?,83.0,Stanley Donen,Cary Grant,Audrey Hepburn,Walter Matthau,James Coburn,68689,13474588,Nyrae Dawn,7.94,37302.0
548,"https://m.media-amazon.com/images/M/MV5BOTY0ZTA1ZjUtN2MyNi00ZGRmLWExYmMtOTkyNzI1NGQ2Y2RlXkEyXkFqcGdeQXVyNjc1NTYyMjg@._V1_UX67_CR0,0,67,98_AL_.jpg",The Manchurian Candidate,1962,PG-13,126 min,"Drama, Thriller",7.9,A former prisoner of war is brainwashed as an unwitting assassin for an international Communist conspiracy.,94.0,John Frankenheimer,Frank Sinatra,Laurence Harvey,Janet Leigh,Angela Lansbury,71122,,Richard Condon,8.18,23955.0
549,"https://m.media-amazon.com/images/M/MV5BMjc4MTUxN2UtMmU1NC00MjQyLTk3YTYtZTQ0YzEzZDc0Njc0XkEyXkFqcGdeQXVyNjU0OTQ0OTY@._V1_UX67_CR0,0,67,98_AL_.jpg",Spartacus,1960,A,197 min,"Adventure, Biography, Drama",7.9,The slave Spartacus leads a violent revolt against the decadent Roman Republic.,87.0,Stanley Kubrick,Kirk Douglas,Laurence Olivier,Jean Simmons,Charles Laughton,124339,30000000,Ben Kane,8.1,2535.0
551,"https://m.media-amazon.com/images/M/MV5BMzY2NTA1MzUwN15BMl5BanBnXkFtZTgwOTc4NTU4MjE@._V1_UX67_CR0,0,67,98_AL_.jpg",Hiroshima mon amour,1959,,90 min,"Drama, Romance",7.9,A French actress filming an anti-war film in Hiroshima has an affair with a married Japanese architect as they share their differing perspectives on war.,,Alain Resnais,Emmanuelle Riva,Eiji Okada,Stella Dassas,Pierre Barbaud,28421,88300,Marguerite Duras,7.78,5074.0
552,"https://m.media-amazon.com/images/M/MV5BODcxYjUxZDgtYTQ5Zi00YmQ1LWJmZmItODZkOTYyNDhiNWM3XkEyXkFqcGdeQXVyNjc1NTYyMjg@._V1_UX67_CR0,0,67,98_AL_.jpg",The Ten Commandments,1956,U,220 min,"Adventure, Drama",7.9,"Moses, an Egyptian Prince, learns of his true heritage as a Hebrew and his divine mission as the deliverer of his people.",,Cecil B. DeMille,Charlton Heston,Yul Brynner,Anne Baxter,Edward G. Robinson,63560,93740000,Stephen Clarke,7.54,2424.0
553,"https://m.media-amazon.com/images/M/MV5BYWQ3YWJiMDEtMDBhNS00YjY1LTkzNmEtY2U4Njg4MjQ3YWE3XkEyXkFqcGdeQXVyNzkwMjQ5NzM@._V1_UX67_CR0,0,67,98_AL_.jpg",The Searchers,1956,Passed,119 min,"Adventure, Drama, Western",7.9,An American Civil War veteran embarks on a journey to rescue his niece from the Comanches.,94.0,John Ford,John Wayne,Jeffrey Hunter,Vera Miles,Ward Bond,80316,,Tana French,7.6,106706.0
554,"https://m.media-amazon.com/images/M/MV5BMzE1MzdjNmUtOWU5MS00OTgwLWIzYjYtYTYwYTM0NDkyOTU1XkEyXkFqcGdeQXVyMTY5Nzc4MDY@._V1_UX67_CR0,0,67,98_AL_.jpg",East of Eden,1955,U,118 min,Drama,7.9,"Two brothers struggle to maintain their strict, Bible-toting father's favor.",72.0,Elia Kazan,James Dean,Raymond Massey,Julie Harris,Burl Ives,40313,,John Steinbeck,8.8,493971.0
555,"https://m.media-amazon.com/images/M/MV5BOWIzZGUxZmItOThkMS00Y2QxLTg0MTYtMDdhMjRlNTNlYTI3L2ltYWdlXkEyXkFqcGdeQXVyNjc1NTYyMjg@._V1_UX67_CR0,0,67,98_AL_.jpg",High Noon,1952,PG,85 min,"Drama, Thriller, Western",7.9,"A town Marshal, despite the disagreements of his newlywed bride and the townspeople around him, must face a gang of deadly killers alone at high noon when the gang leader, an outlaw he sent up years ago, arrives on the noon train.",89.0,Fred Zinnemann,Gary Cooper,Grace Kelly,Thomas Mitchell,Lloyd Bridges,97222,9450000,Nora Roberts,8.02,29132.0
556,"https://m.media-amazon.com/images/M/MV5BNzkwNjk4ODgtYjRmMi00ODdhLWIyNjUtNWQyMjg2N2E2NjlhXkEyXkFqcGdeQXVyNjE5MjUyOTM@._V1_UX67_CR0,0,67,98_AL_.jpg",Strangers on a Train,1951,A,101 min,"Crime, Film-Noir, Thriller",7.9,A psychopath forces a tennis star to comply with his theory that two strangers can get away with murder.,88.0,Alfred Hitchcock,Farley Granger,Robert Walker,Ruth Roman,Leo G. Carroll,123341,7630000,Patricia Highsmith,7.48,27797.0
558,"https://m.media-amazon.com/images/M/MV5BNjRkOGEwYTUtY2E5Yy00ODg4LTk2ZWItY2IyMzUxOGVhMTM1XkEyXkFqcGdeQXVyNDk0MDg4NDk@._V1_UX67_CR0,0,67,98_AL_.jpg",Miracle on 34th Street,1947,,96 min,"Comedy, Drama, Family",7.9,"When a nice old man who claims to be Santa Claus is institutionalized as insane, a young lawyer decides to defend him by arguing in court that he is the real thing.",88.0,George Seaton,Edmund Gwenn,Maureen O'Hara,John Payne,Gene Lockhart,41625,2650000,Valentine Davies,8.14,2702.0
560,"https://m.media-amazon.com/images/M/MV5BMjdiM2IyZmQtODJiYy00NDNkLTllYmItMmFjMDNiYTQyOGVkXkEyXkFqcGdeQXVyNDY2MTk1ODk@._V1_UX67_CR0,0,67,98_AL_.jpg",The Big Sleep,1946,Passed,114 min,"Crime, Film-Noir, Mystery",7.9,"Private detective Philip Marlowe is hired by a wealthy family. Before the complex case is over, he's seen murder, blackmail, and what might be love.",,Howard Hawks,Humphrey Bogart,Lauren Bacall,John Ridgely,Martha Vickers,78796,6540000,Raymond Chandler,7.92,145796.0
561,"https://m.media-amazon.com/images/M/MV5BMTk4NDQ0NjgyNF5BMl5BanBnXkFtZTgwMTE3NTkxMTE@._V1_UX67_CR0,0,67,98_AL_.jpg",The Lost Weekend,1945,Passed,101 min,"Drama, Film-Noir",7.9,The desperate life of a chronic alcoholic is followed through a four-day drinking bout.,,Billy Wilder,Ray Milland,Jane Wyman,Phillip Terry,Howard Da Silva,33549,9460000,Charles R. Jackson,8.16,1898.0
563,"https://m.media-amazon.com/images/M/MV5BZDVmZTZkYjMtNmViZC00ODEzLTgwNDAtNmQ3OGQwOWY5YjFmXkEyXkFqcGdeQXVyNDY2MTk1ODk@._V1_UX67_CR0,0,67,98_AL_.jpg",His Girl Friday,1940,Passed,92 min,"Comedy, Drama, Romance",7.9,A newspaper editor uses every trick in the book to keep his ace reporter ex-wife from remarrying.,,Howard Hawks,Cary Grant,Rosalind Russell,Ralph Bellamy,Gene Lockhart,53667,296000,Diana Palmer,7.9,658.0
564,"https://m.media-amazon.com/images/M/MV5BYjZjOTU3MTMtYTM5YS00YjZmLThmNmMtODcwOTM1NmRiMWM2XkEyXkFqcGdeQXVyNjc1NTYyMjg@._V1_UX67_CR0,0,67,98_AL_.jpg",The Adventures of Robin Hood,1938,PG,102 min,"Action, Adventure, Romance",7.9,"When Prince John and the Norman Lords begin oppressing the Saxon masses in King Richard's absence, a Saxon lord fights back as the outlaw leader of a rebel guerrilla army.",97.0,Michael Curtiz,William Keighley,Errol Flynn,Olivia de Havilland,Basil Rathbone,47175,3981000,Howard Pyle,8.14,62766.0
566,"https://m.media-amazon.com/images/M/MV5BZTY3YjYxZGQtMTM2YS00ZmYwLWFlM2QtOWFlMTU1NTAyZDQ2XkEyXkFqcGdeQXVyNTgyNTA4MjM@._V1_UX67_CR0,0,67,98_AL_.jpg",King Kong,1933,Passed,100 min,"Adventure, Horror, Sci-Fi",7.9,A film crew goes to a tropical island for an exotic location shoot and discovers a colossal ape who takes a shine to their female blonde star. He is then captured and brought back to New York City for public exhibition.,90.0,Merian C. Cooper,Ernest B. Schoedsack,Fay Wray,Robert Armstrong,Bruce Cabot,78991,10000000,James McBride,8.36,57640.0
569,"https://m.media-amazon.com/images/M/MV5BMTlkMmVmYjktYTc2NC00ZGZjLWEyOWUtMjc2MDMwMjQwOTA5XkEyXkFqcGdeQXVyNTI4MzE4MDU@._V1_UX67_CR0,0,67,98_AL_.jpg",The Gentlemen,2019,A,113 min,"Action, Comedy, Crime",7.8,"An American expat tries to sell off his highly profitable marijuana empire in London, triggering plots, schemes, bribery and blackmail in an attempt to steal his domain out from under him.",51.0,Guy Ritchie,Matthew McConaughey,Charlie Hunnam,Michelle Dockery,Jeremy Strong,237392,,William Shakespeare,6.82,14382.0
571,"https://m.media-amazon.com/images/M/MV5BNjcyYjg0M2ItMzMyZS00NmM1LTlhZDMtN2MxN2RhNWY4YTkwXkEyXkFqcGdeQXVyNjY1MTg4Mzc@._V1_UX67_CR0,0,67,98_AL_.jpg",Sound of Metal,2019,R,120 min,"Drama, Music",7.8,A heavy-metal drummer's life is thrown into freefall when he begins to lose his hearing.,81.0,Darius Marder,Riz Ahmed,Olivia Cooke,Paul Raci,Lauren Ridloff,27187,,Darius Marder,8.46,13.0
573,"https://m.media-amazon.com/images/M/MV5BN2YyZjQ0NTEtNzU5MS00NGZkLTg0MTEtYzJmMWY3MWRhZjM2XkEyXkFqcGdeQXVyMDA4NzMyOA@@._V1_UX67_CR0,0,67,98_AL_.jpg",Dunkirk,2017,UA,106 min,"Action, Drama, History",7.8,"Allied soldiers from Belgium, the British Empire, and France are surrounded by the German Army and evacuated during a fierce battle in World War II.",94.0,Christopher Nolan,Fionn Whitehead,Barry Keoghan,Mark Rylance,Tom Hardy,555092,188373161,Lee Jackson,8.78,7639.0
574,"https://m.media-amazon.com/images/M/MV5BNDQzZmQ5MjItYmJlNy00MGI2LWExMDQtMjBiNjNmMzc5NTk1XkEyXkFqcGdeQXVyNjY1OTY4MTk@._V1_UY98_CR1,0,67,98_AL_.jpg",Perfetti sconosciuti,2016,,96 min,"Comedy, Drama",7.8,"Seven long-time friends get together for a dinner. When they decide to share with each other the content of every text message, email and phone call they receive, many secrets start to unveil and the equilibrium trembles.",,Paolo Genovese,Giuseppe Battiston,Anna Foglietta,Marco Giallini,Edoardo Leo,57168,,Liane Moriarty,7.08,381751.0
575,"https://m.media-amazon.com/images/M/MV5BMzg2Mzg4YmUtNDdkNy00NWY1LWE3NmEtZWMwNGNlMzE5YzU3XkEyXkFqcGdeQXVyMjA5MTIzMjQ@._V1_UX67_CR0,0,67,98_AL_.jpg",Hidden Figures,2016,UA,127 min,"Biography, Drama, History",7.8,The story of a team of female African-American mathematicians who served a vital role in NASA during the early years of the U.S. space program.,74.0,Theodore Melfi,Taraji P. Henson,Octavia Spencer,Janelle Monáe,Kevin Costner,200876,169607287,Margot Lee Shetterly,7.94,97893.0
576,"https://m.media-amazon.com/images/M/MV5BMmYwNWZlNzEtNjE4Zi00NzQ4LWI2YmUtOWZhNzZhZDYyNmVmXkEyXkFqcGdeQXVyNzYzODM3Mzg@._V1_UX67_CR0,0,67,98_AL_.jpg",Paddington 2,2017,U,103 min,"Adventure, Comedy, Family",7.8,"Paddington (Ben Whishaw), now happily settled with the Brown family and a popular member of the local community, picks up a series of odd jobs to buy the perfect present for his Aunt Lucy's (Imelda Staunton's) 100th birthday, only for the gift to be stolen.",88.0,Paul King,Ben Whishaw,Hugh Grant,Hugh Bonneville,Sally Hawkins,61594,40442052,Michael Bond,8.5,3281.0
578,"https://m.media-amazon.com/images/M/MV5BMjA2Mzg2NDMzNl5BMl5BanBnXkFtZTgwMjcwODUzOTE@._V1_UX67_CR0,0,67,98_AL_.jpg",Kubo and the Two Strings,2016,PG,101 min,"Animation, Action, Adventure",7.8,A young boy named Kubo must locate a magical suit of armour worn by his late father in order to defeat a vengeful spirit from the past.,84.0,Travis Knight,Charlize Theron,Art Parkinson,Matthew McConaughey,Ralph Fiennes,118035,48023088,Emily Haynes,8.48,178.0
580,"https://m.media-amazon.com/images/M/MV5BMTYxMjk0NDg4Ml5BMl5BanBnXkFtZTgwODcyNjA5OTE@._V1_UX67_CR0,0,67,98_AL_.jpg",Manchester by the Sea,2016,UA,137 min,Drama,7.8,A depressed uncle is asked to take care of his teenage nephew after the boy's father dies.,96.0,Kenneth Lonergan,Casey Affleck,Michelle Williams,Kyle Chandler,Lucas Hedges,246963,47695120,Kenneth Lonergan,7.94,130.0
581,"https://m.media-amazon.com/images/M/MV5BMjA0MzQzNjM1Ml5BMl5BanBnXkFtZTgwNjM5MjU5NjE@._V1_UX67_CR0,0,67,98_AL_.jpg",Under sandet,2015,R,100 min,"Drama, History, War",7.8,"In post-World War II Denmark, a group of young German POWs are forced to clear a beach of thousands of land mines under the watch of a Danish Sergeant who slowly learns to appreciate their plight.",75.0,Martin Zandvliet,Roland Møller,Louis Hofmann,Joel Basman,Mikkel Boe Følsgaard,35539,435266,Jean Van Hamme,7.22,545.0
582,"https://m.media-amazon.com/images/M/MV5BMjEwMzMxODIzOV5BMl5BanBnXkFtZTgwNzg3OTAzMDI@._V1_UX67_CR0,0,67,98_AL_.jpg",Rogue One,2016,UA,133 min,"Action, Adventure, Sci-Fi",7.8,The daughter of an Imperial scientist joins the Rebel Alliance in a risky move to steal the plans for the Death Star.,65.0,Gareth Edwards,Felicity Jones,Diego Luna,Alan Tudyk,Donnie Yen,556608,532177324,Evie Dunmore,8.06,31980.0
583,"https://m.media-amazon.com/images/M/MV5BMjQ0MTgyNjAxMV5BMl5BanBnXkFtZTgwNjUzMDkyODE@._V1_UX67_CR0,0,67,98_AL_.jpg",Captain America: Civil War,2016,UA,147 min,"Action, Adventure, Sci-Fi",7.8,Political involvement in the Avengers' affairs causes a rift between Captain America and Iron Man.,75.0,Anthony Russo,Joe Russo,Chris Evans,Robert Downey Jr.,Scarlett Johansson,663649,408084349,Ed Brubaker,8.14,5269.0
584,"https://m.media-amazon.com/images/M/MV5BMjA1MTc1NTg5NV5BMl5BanBnXkFtZTgwOTM2MDEzNzE@._V1_UX67_CR0,0,67,98_AL_.jpg",The Hateful Eight,2015,A,168 min,"Crime, Drama, Mystery",7.8,"In the dead of a Wyoming winter, a bounty hunter and his prisoner find shelter in a cabin currently inhabited by a collection of nefarious characters.",68.0,Quentin Tarantino,Samuel L. Jackson,Kurt Russell,Jennifer Jason Leigh,Walton Goggins,517059,54117416,Quentin Tarantino,8.52,491.0
585,"https://m.media-amazon.com/images/M/MV5BY2QzYTQyYzItMzAwYi00YjZlLThjNTUtNzMyMDdkYzJiNWM4XkEyXkFqcGdeQXVyMTkxNjUyNQ@@._V1_UX67_CR0,0,67,98_AL_.jpg",Little Women,2019,U,135 min,"Drama, Romance",7.8,"Jo March reflects back and forth on her life, telling the beloved story of the March sisters - four young women, each determined to live life on her own terms.",91.0,Greta Gerwig,Saoirse Ronan,Emma Watson,Florence Pugh,Eliza Scanlen,143250,108101214,Louisa May Alcott,8.26,2039227.0
